Title,Key Facts,chassis,mileage,engine,gearbox,color,interior,steering,fuel_type,Vehicle location,Background,Overview,Estimated value,Seller,exterior,Exterior_Images,interior_Images,mechanical,mechanical_Images,History,History_Images,Summary
1937 MG TA,"['Only 4 Previous Keeps', 'UK RHD', 'Photographic record of restoration', 'Features the better XPAG engine', 'An older, documented and fastidious restoration']",TA/1867,2818 Miles,1250cc,Manual,Blue,"The TA’s cabin looks every inch the equal of the exterior, being finished in a period-feel air force blue hue. The rear-hinged doors open widely to allow access to the full-width bench seat The back of this is formed of a single piece which is stitched into vertical box pleats. This works in conjunction with two sperate seat squabs placed either side of the transmission tunnel to provide commodious seating for two. The door cards on the rear hinged doors are finished in a matching substrate and include a pair of generous map pockets. Carpeting is finished in a darker blue and appears in a fine condition, too. 
The “moustache” shaped dashboard fascia is finished in a wood veneer. A family of British Jaeger gauges populate the panel. The big, convex lenses tachometer sits directly ahead of the driver with a matching speedometer placed ahead of the passenger (what could possibly go wrong?). Auxiliary gauges monitoring oil pressure, amps and water temperature are also present. A “banjo” style four spoke Bluemel’s Brooklands steering wheel is fitted which incorporates a polished boss with MG embossing. 
Charming period details include a folding windscreen, a single windscreen wiper motor operating a cantilever arrangement for both wipers and a portrait orientated, convex lensed wing mirror. The condition of the interior and its faithful originality should be much admired.",Right-Hand Drive,Petrol,"Inverurie, Aberdeenshire, United Kingdom","Purists seem to consider the origins of the T type MGs to germinate with the arrival of the M type in 1928. The M type was the first model to be known as a “midget,” a moniker that would continue to be applied to the small MGs right up to the Midget 1500 of 1974. The M type was also considered the first car produced by MG in its own right. Prior to this, MGs were special, rebodied versions of Morris models produced and promoted by Morris’s General Manager, Cecil Kimber. The MG Car Company was registered in its own right only a few weeks before the 1928 London Motor Show at which the M type was premiered.
Over the next eight years the M type was revised and improved to create the C and D types in 1931, the J type in 1932 and ultimately the P type in 1934. The PB that followed was considered to be a much-improved car with its Morris origins now almost completely expunged. Supply problems with the PB’s Wolseley derived overhead camshaft engine led to the car’s demise in 1936.
The MG TA that followed looked similar to the outgoing PB but was fundamentally different in virtually every other way. The TA had a bigger (1292cc versus 939cc) and more powerful (50 hp as opposed to 46 hp) engine. It was a bigger car with a 7” longer wheelbase was longer, making it significantly roomier and more comfortable. The civilising improvements extended to hydraulic brakes and, from August 1936, the addition of a synchromesh on third and fourth gear; a first for the MG midget line. 
The arrival of the TA really marked a transformational watershed in MG’s development. The more “grown up” nature of the new car helped endear the brand to a broader motoring demographic. No longer were its sports cars just the preserve of the dyed in the wool enthusiast, but now offered something to appeal to almost all motorists. The wider appeal of the TA in no way diminished its sporting credentials, however. The standard car was good for over 80mph, and a TA even won its class in the 1939 Australian Grand Prix. Initially priced at the same level as the outgoing PB, a competitive £222 in the UK, the TA represented impressive value. As such it did good business, selling around 3,000 units across its 3-year production window.","This fine-looking TA was first registered in Northern Ireland in December 1937 and was thought to have left the Abingdon factory in a grey livery. A second keeper followed who appears to have resided in the Greater London area, certainly during the 1960’s at least. By 2003 the MG had moved on to its third custodian and was now sporting an Old English White livery.
Clearly ripe for a little improvement at this stage, the third keeper embarked on what can only be described as a labour of love to bring the diminutive MG back up to a near factory condition. This fastidious process unfolded over the subsequent seven years, and it is clear that every facet of the TA received the attention it deserved. This third keeper helpfully kept a detailed record, both written and photographic, of every stage of the restoration process which lends some fascinating and valuable provenance to this TA.
In 2010 the fourth previous owner acquired the TA, now in its new and eye-catching Saxe Blue hue. Current owner, Rod, acquired the MG TA in 2013 and has lovingly and carefully curated this remarkable pre-war sports car ever since. This care and attention has extended to the MG enjoying a controlled environment within an air shroud in Rod’s garage.","£20,000 - £30,000",Private: Rod Garvie,"Despite looking very similar to its predecessor, the PB, the TA’s extra 7-inch length did much to balance the look of the car in a positive direction. With such a long and prominent bonnet, the PB’s sharply cut off rear looked a little severe and those extra inches in the TA’s chassis did much to improve the aesthetics. Despite this enlarged footprint the TA remains charmingly diminutive by today’s standards reminding us of how little real estate is actually needed to transport two humans at speeds approaching 80 mph.
This example presents in sophisticated Saxe Blue courtesy of keeper number three’s restoration project in the early 2000’s. The shade suits the car’s well-crafted lines perfectly and seems to add to the TA’s status as a more grown up and useable sports car. The car has clearly been sympathetically used and enjoyed since, then, as the condition of paint and bodywork appears excellent throughout. Judging by the odometer progression in the last 14 years it seems like the MG has covered less than 2,000 or so miles since the completion of its restoration.
The deep blue livery is further complemented by the gleaming brightwork in evidence around the car. This includes radiator shell, headlamp bowls, windscreen surround, wing mirrors and the like. The front aspect of the MG is dominated by those dinner-plate sized headlamps and their mesh stone guards. These sit either side of the tall, vertically slatted radiator. The rear profile of the car is dominated by the body-coloured, externally mounted petrol tank and accompanying spare wire wheel and unused tyre. 
The black, fabric hood appears tightly fitting and in excellent condition. The rear acetate windows are clear and free from obscuring folds or crack. Matching side screens affix to the door tops to complete the full complement of weather protection precautions. A full-length tonneau is also provided.
The TA rides on a set of cross spoked wire wheels that are finished in a silver-grey hue. Their condition appears excellent throughout and are dressed in a set of chromed MG twin-eared spinners A set of new looking, period-appropriate radial tyres are fitted.","https://bonhamscarsonline.twic.pics/210dcc6e-b610-48f2-910a-a846c50c498d/6008ad13-6d71-43c9-95e8-02ca2f57044a.jpg?twic=v1/resize=650&twic=v1/cover=250x188, https://bonhamscarsonline.twic.pics/210dcc6e-b610-48f2-910a-a846c50c498d/be8cbceb-c429-4131-b80e-dc4d5a90b844.jpg?twic=v1/resize=650&twic=v1/cover=250x188, https://bonhamscarsonline.twic.pics/210dcc6e-b610-48f2-910a-a846c50c498d/1a149755-f57d-4703-86c0-7d343fee018e.jpg?twic=v1/resize=650&twic=v1/cover=250x188, https://bonhamscarsonline.twic.pics/210dcc6e-b610-48f2-910a-a846c50c498d/bcc54d33-31c2-4254-bcbd-662b36641462.jpg?twic=v1/resize=650&twic=v1/cover=250x188, https://bonhamscarsonline.twic.pics/210dcc6e-b610-48f2-910a-a846c50c498d/3538ad0d-36e7-4f62-99ca-9a6cbdbe610b.jpg?twic=v1/resize=650&twic=v1/cover=250x188, https://bonhamscarsonline.twic.pics/210dcc6e-b610-48f2-910a-a846c50c498d/c7ca3c4b-d268-43da-9e5e-8947ab47b164.jpg?twic=v1/resize=650&twic=v1/cover=250x188, https://bonhamscarsonline.twic.pics/210dcc6e-b610-48f2-910a-a846c50c498d/79a67883-31a3-4365-afd5-e7aa4fe4a371.jpg?twic=v1/resize=650&twic=v1/cover=250x188, https://bonhamscarsonline.twic.pics/210dcc6e-b610-48f2-910a-a846c50c498d/f44ce3f3-aaa9-436a-9959-2d15d615215b.jpg?twic=v1/resize=650&twic=v1/cover=250x188, https://bonhamscarsonline.twic.pics/210dcc6e-b610-48f2-910a-a846c50c498d/ad7efb09-bf27-42b2-a270-861bfe339ec2.jpg?twic=v1/resize=650&twic=v1/cover=250x188, https://bonhamscarsonline.twic.pics/210dcc6e-b610-48f2-910a-a846c50c498d/ec90a2f3-452a-47d3-88b5-53309d53035b.jpg?twic=v1/resize=650&twic=v1/cover=250x188, https://bonhamscarsonline.twic.pics/210dcc6e-b610-48f2-910a-a846c50c498d/3758b776-9e82-4b56-b60c-3f2140a13784.jpg?twic=v1/resize=650&twic=v1/cover=250x188, https://bonhamscarsonline.twic.pics/210dcc6e-b610-48f2-910a-a846c50c498d/efda32a6-c965-487e-81e6-5b6664583db2.jpg?twic=v1/resize=650&twic=v1/cover=250x188, https://bonhamscarsonline.twic.pics/210dcc6e-b610-48f2-910a-a846c50c498d/77580a9c-26a1-4f77-b2bc-1700a14e5bd7.jpg?twic=v1/resize=650&twic=v1/cover=250x188, https://bonhamscarsonline.twic.pics/210dcc6e-b610-48f2-910a-a846c50c498d/4189f4a8-227a-4b12-9795-f0e7375f0eb1.jpg?twic=v1/resize=650&twic=v1/cover=250x188, https://bonhamscarsonline.twic.pics/210dcc6e-b610-48f2-910a-a846c50c498d/f92c459b-bacf-4c16-9463-406c3a198ddc.jpg?twic=v1/resize=650&twic=v1/cover=250x188, https://bonhamscarsonline.twic.pics/210dcc6e-b610-48f2-910a-a846c50c498d/24d94104-b567-470c-b8ec-3192b517d19e.jpg?twic=v1/resize=650&twic=v1/cover=250x188, https://bonhamscarsonline.twic.pics/210dcc6e-b610-48f2-910a-a846c50c498d/b77d1f1b-a5c1-4486-ba91-0adc5f2d59dd.jpg?twic=v1/resize=650&twic=v1/cover=250x188, https://bonhamscarsonline.twic.pics/210dcc6e-b610-48f2-910a-a846c50c498d/41fd52b5-96c1-4303-be7d-89e1d5b965f6.jpg?twic=v1/resize=650&twic=v1/cover=250x188, https://bonhamscarsonline.twic.pics/210dcc6e-b610-48f2-910a-a846c50c498d/d5b0b6ea-069c-4f95-95de-9a258926329c.jpg?twic=v1/resize=650&twic=v1/cover=250x188, https://bonhamscarsonline.twic.pics/210dcc6e-b610-48f2-910a-a846c50c498d/1504bf69-9491-40f2-a0e7-b8426bc8596a.jpg?twic=v1/resize=650&twic=v1/cover=250x188, https://bonhamscarsonline.twic.pics/210dcc6e-b610-48f2-910a-a846c50c498d/802b7d1b-ca31-454e-8d43-18d01fa673d8.jpg?twic=v1/resize=650&twic=v1/cover=250x188, https://bonhamscarsonline.twic.pics/210dcc6e-b610-48f2-910a-a846c50c498d/a7b48cac-613e-4f0b-8b82-db4b0acce391.jpg?twic=v1/resize=650&twic=v1/cover=250x188, https://bonhamscarsonline.twic.pics/210dcc6e-b610-48f2-910a-a846c50c498d/4d7d38a0-af13-4679-9919-a83b07833dd9.jpg?twic=v1/resize=650&twic=v1/cover=250x188, https://bonhamscarsonline.twic.pics/210dcc6e-b610-48f2-910a-a846c50c498d/23c532f0-f8b1-4512-a8d0-c3042f3affc8.jpg?twic=v1/resize=650&twic=v1/cover=250x188, https://bonhamscarsonline.twic.pics/210dcc6e-b610-48f2-910a-a846c50c498d/301ab283-7d2e-4476-b113-17dc6892bc99.jpg?twic=v1/resize=650&twic=v1/cover=250x188, https://bonhamscarsonline.twic.pics/210dcc6e-b610-48f2-910a-a846c50c498d/7bed90a8-bda6-4107-8a5e-e33ec8607c35.jpg?twic=v1/resize=650&twic=v1/cover=250x188, https://bonhamscarsonline.twic.pics/210dcc6e-b610-48f2-910a-a846c50c498d/4ec5a9e7-8027-44ab-80fa-f6c27f52e7f9.jpg?twic=v1/resize=650&twic=v1/cover=250x188, https://bonhamscarsonline.twic.pics/210dcc6e-b610-48f2-910a-a846c50c498d/c123c224-cee9-4f55-923c-f3e73b1c78dc.jpg?twic=v1/resize=650&twic=v1/cover=250x188, https://bonhamscarsonline.twic.pics/210dcc6e-b610-48f2-910a-a846c50c498d/ddcf2f55-0940-4936-ba70-0b3422097c1a.jpg?twic=v1/resize=650&twic=v1/cover=250x188, https://bonhamscarsonline.twic.pics/210dcc6e-b610-48f2-910a-a846c50c498d/10d28c01-ce35-4e0d-a971-fdeaefa24f64.jpg?twic=v1/resize=650&twic=v1/cover=250x188, https://bonhamscarsonline.twic.pics/210dcc6e-b610-48f2-910a-a846c50c498d/ee6c2ef8-158f-4e44-b225-1a64d2553e4e.jpg?twic=v1/resize=650&twic=v1/cover=250x188, https://bonhamscarsonline.twic.pics/210dcc6e-b610-48f2-910a-a846c50c498d/b70bbafd-2362-4b43-baf5-01f07413e412.jpg?twic=v1/resize=650&twic=v1/cover=250x188, https://bonhamscarsonline.twic.pics/210dcc6e-b610-48f2-910a-a846c50c498d/82a40e2b-50c9-40bf-9963-0db1c496dced.jpg?twic=v1/resize=650&twic=v1/cover=250x188, https://bonhamscarsonline.twic.pics/210dcc6e-b610-48f2-910a-a846c50c498d/851a4b87-b1b7-480b-b381-1df098f0f349.jpg?twic=v1/resize=650&twic=v1/cover=250x188, https://bonhamscarsonline.twic.pics/210dcc6e-b610-48f2-910a-a846c50c498d/2f2e09b1-2648-4ec0-926a-adfc717c976a.jpg?twic=v1/resize=650&twic=v1/cover=250x188, https://bonhamscarsonline.twic.pics/210dcc6e-b610-48f2-910a-a846c50c498d/cfd762b5-5c96-46e6-84f5-b7510433c741.jpg?twic=v1/resize=650&twic=v1/cover=250x188, https://bonhamscarsonline.twic.pics/210dcc6e-b610-48f2-910a-a846c50c498d/4fa901ef-f1b1-44a1-8263-7855824e8fc4.jpg?twic=v1/resize=650&twic=v1/cover=250x188, https://bonhamscarsonline.twic.pics/210dcc6e-b610-48f2-910a-a846c50c498d/c091c2ac-7b64-4ac5-805a-b1387d34c4fc.jpg?twic=v1/resize=650&twic=v1/cover=250x188, https://bonhamscarsonline.twic.pics/210dcc6e-b610-48f2-910a-a846c50c498d/b4123eb9-b597-46c6-8534-82606b294ef4.jpg?twic=v1/resize=650&twic=v1/cover=250x188, https://bonhamscarsonline.twic.pics/210dcc6e-b610-48f2-910a-a846c50c498d/2acd404a-fe64-4cd2-afd7-15d77a853d68.jpg?twic=v1/resize=650&twic=v1/cover=250x188, https://bonhamscarsonline.twic.pics/210dcc6e-b610-48f2-910a-a846c50c498d/461900ae-7b92-4452-b9f2-abbaf9a8da0a.jpg?twic=v1/resize=650&twic=v1/cover=250x188, https://bonhamscarsonline.twic.pics/210dcc6e-b610-48f2-910a-a846c50c498d/b3e4b846-260c-4549-b20b-5b519feb5f1b.jpg?twic=v1/resize=650&twic=v1/cover=250x188, https://bonhamscarsonline.twic.pics/210dcc6e-b610-48f2-910a-a846c50c498d/d76d2c86-679a-48f0-ad5b-c11595cebc6b.jpg?twic=v1/resize=650&twic=v1/cover=250x188, https://bonhamscarsonline.twic.pics/210dcc6e-b610-48f2-910a-a846c50c498d/3d4bd5f4-26f8-469a-bd8e-d0e120d43e4d.jpg?twic=v1/resize=650&twic=v1/cover=250x188, https://bonhamscarsonline.twic.pics/210dcc6e-b610-48f2-910a-a846c50c498d/b01ccd5d-f833-4694-a641-85f460a842aa.jpg?twic=v1/resize=650&twic=v1/cover=250x188, https://bonhamscarsonline.twic.pics/210dcc6e-b610-48f2-910a-a846c50c498d/0d330c5c-5cb5-43d7-a1cc-ed2acbb29e30.jpg?twic=v1/resize=650&twic=v1/cover=250x188, https://bonhamscarsonline.twic.pics/210dcc6e-b610-48f2-910a-a846c50c498d/a908a310-b5d1-4d3d-b699-45687f8fb1f1.jpg?twic=v1/resize=650&twic=v1/cover=250x188, https://bonhamscarsonline.twic.pics/210dcc6e-b610-48f2-910a-a846c50c498d/369f3289-85f4-4c1e-b833-22a8164d6d25.jpg?twic=v1/resize=650&twic=v1/cover=250x188, https://bonhamscarsonline.twic.pics/210dcc6e-b610-48f2-910a-a846c50c498d/21162d7b-071f-4eda-bd3a-54cb4acf9be9.jpg?twic=v1/resize=650&twic=v1/cover=250x188, https://bonhamscarsonline.twic.pics/210dcc6e-b610-48f2-910a-a846c50c498d/9d24f88b-8dd8-4279-8741-c95c76430b0b.jpg?twic=v1/resize=650&twic=v1/cover=250x188, https://bonhamscarsonline.twic.pics/210dcc6e-b610-48f2-910a-a846c50c498d/2fad0b6d-b4d4-4114-bbfc-22dc6fbdc868.jpg?twic=v1/resize=650&twic=v1/cover=250x188, https://bonhamscarsonline.twic.pics/210dcc6e-b610-48f2-910a-a846c50c498d/00306153-a2dc-4c1c-bd81-7132bee27e21.jpg?twic=v1/resize=650&twic=v1/cover=250x188, https://bonhamscarsonline.twic.pics/210dcc6e-b610-48f2-910a-a846c50c498d/4cb3e980-98df-4d2f-8107-6a44af5b7bec.jpg?twic=v1/resize=650&twic=v1/cover=250x188, https://bonhamscarsonline.twic.pics/210dcc6e-b610-48f2-910a-a846c50c498d/6bc97d6b-6169-4df0-b949-4ea55448c559.jpg?twic=v1/resize=650&twic=v1/cover=250x188, https://bonhamscarsonline.twic.pics/210dcc6e-b610-48f2-910a-a846c50c498d/d93490f3-f6e6-4d46-bac3-c96cb767bfb0.jpg?twic=v1/resize=650&twic=v1/cover=250x188, https://bonhamscarsonline.twic.pics/210dcc6e-b610-48f2-910a-a846c50c498d/dc7b4457-9e37-46e1-b52e-52cf69ae833a.jpg?twic=v1/resize=650&twic=v1/cover=250x188","https://bonhamscarsonline.twic.pics/210dcc6e-b610-48f2-910a-a846c50c498d/fbae906b-3565-40be-874f-71ec16220f43.jpg?twic=v1/resize=650&twic=v1/cover=250x188, https://bonhamscarsonline.twic.pics/210dcc6e-b610-48f2-910a-a846c50c498d/40211cd8-fbb2-4143-a269-d8db17fbb95a.jpg?twic=v1/resize=650&twic=v1/cover=250x188, https://bonhamscarsonline.twic.pics/210dcc6e-b610-48f2-910a-a846c50c498d/6de8872a-c342-4f07-acae-71ea1dcc8a14.jpg?twic=v1/resize=650&twic=v1/cover=250x188, https://bonhamscarsonline.twic.pics/210dcc6e-b610-48f2-910a-a846c50c498d/860a523e-33a8-444a-924f-433261d7123d.jpg?twic=v1/resize=650&twic=v1/cover=250x188, https://bonhamscarsonline.twic.pics/210dcc6e-b610-48f2-910a-a846c50c498d/5ca7d8c9-3313-4ef2-9d40-16c9f4d2b85f.jpg?twic=v1/resize=650&twic=v1/cover=250x188, https://bonhamscarsonline.twic.pics/210dcc6e-b610-48f2-910a-a846c50c498d/883c4e5d-f833-43ba-9b8d-fc10474574e1.jpg?twic=v1/resize=650&twic=v1/cover=250x188, https://bonhamscarsonline.twic.pics/210dcc6e-b610-48f2-910a-a846c50c498d/4987e127-cf95-4e5f-8b9b-fee7eea4d492.jpg?twic=v1/resize=650&twic=v1/cover=250x188, https://bonhamscarsonline.twic.pics/210dcc6e-b610-48f2-910a-a846c50c498d/9601e668-f771-4ea4-9caf-01a7050ab439.jpg?twic=v1/resize=650&twic=v1/cover=250x188, https://bonhamscarsonline.twic.pics/210dcc6e-b610-48f2-910a-a846c50c498d/adb26428-73b9-4b7f-900a-adafe1ea1ba2.jpg?twic=v1/resize=650&twic=v1/cover=250x188, https://bonhamscarsonline.twic.pics/210dcc6e-b610-48f2-910a-a846c50c498d/70f3ed45-0816-4435-8afe-a4125f60a31f.jpg?twic=v1/resize=650&twic=v1/cover=250x188, https://bonhamscarsonline.twic.pics/210dcc6e-b610-48f2-910a-a846c50c498d/af362fdf-4296-434a-8051-c03261d163ec.jpg?twic=v1/resize=650&twic=v1/cover=250x188, https://bonhamscarsonline.twic.pics/210dcc6e-b610-48f2-910a-a846c50c498d/5aa08808-7f46-4ddc-be63-789e8e362910.jpg?twic=v1/resize=650&twic=v1/cover=250x188, https://bonhamscarsonline.twic.pics/210dcc6e-b610-48f2-910a-a846c50c498d/7006c87b-dd7f-4107-bf1b-d5e6cb9f2af3.jpg?twic=v1/resize=650&twic=v1/cover=250x188, https://bonhamscarsonline.twic.pics/210dcc6e-b610-48f2-910a-a846c50c498d/c9732e49-acab-4356-9f76-9cf1644a7c78.jpg?twic=v1/resize=650&twic=v1/cover=250x188, https://bonhamscarsonline.twic.pics/210dcc6e-b610-48f2-910a-a846c50c498d/2a58b60f-5fae-42db-a9aa-1bdc7a351dfc.jpg?twic=v1/resize=650&twic=v1/cover=250x188, https://bonhamscarsonline.twic.pics/210dcc6e-b610-48f2-910a-a846c50c498d/dccf3bba-a3df-4c07-aab4-c11641ce7049.jpg?twic=v1/resize=650&twic=v1/cover=250x188, https://bonhamscarsonline.twic.pics/210dcc6e-b610-48f2-910a-a846c50c498d/38568483-be08-4f39-aba6-4516b3fb7872.jpg?twic=v1/resize=650&twic=v1/cover=250x188, https://bonhamscarsonline.twic.pics/210dcc6e-b610-48f2-910a-a846c50c498d/2c59560b-89b9-44d0-afa0-de6f1d1801f7.jpg?twic=v1/resize=650&twic=v1/cover=250x188, https://bonhamscarsonline.twic.pics/210dcc6e-b610-48f2-910a-a846c50c498d/fad327c3-0a0b-4e05-93f3-1c280dc3b9d3.jpg?twic=v1/resize=650&twic=v1/cover=250x188, https://bonhamscarsonline.twic.pics/210dcc6e-b610-48f2-910a-a846c50c498d/7575589e-1b63-4b5b-baf0-0732331e03f1.jpg?twic=v1/resize=650&twic=v1/cover=250x188, https://bonhamscarsonline.twic.pics/210dcc6e-b610-48f2-910a-a846c50c498d/21de9489-826b-456c-85f1-3e68adb80456.jpg?twic=v1/resize=650&twic=v1/cover=250x188, https://bonhamscarsonline.twic.pics/210dcc6e-b610-48f2-910a-a846c50c498d/572ec0cb-78e8-4c4f-8700-80b1ffed8bd3.jpg?twic=v1/resize=650&twic=v1/cover=250x188, https://bonhamscarsonline.twic.pics/210dcc6e-b610-48f2-910a-a846c50c498d/ce636e2a-edd8-4360-b0ae-741f26e75e84.jpg?twic=v1/resize=650&twic=v1/cover=250x188, https://bonhamscarsonline.twic.pics/210dcc6e-b610-48f2-910a-a846c50c498d/4889c289-03a1-412f-90d2-e96b99759120.jpg?twic=v1/resize=650&twic=v1/cover=250x188, https://bonhamscarsonline.twic.pics/210dcc6e-b610-48f2-910a-a846c50c498d/e5f6a177-17d9-484b-8312-5fa123413000.jpg?twic=v1/resize=650&twic=v1/cover=250x188, https://bonhamscarsonline.twic.pics/210dcc6e-b610-48f2-910a-a846c50c498d/3108a9a6-d7b4-4c89-bafc-6f96d79694f3.jpg?twic=v1/resize=650&twic=v1/cover=250x188, https://bonhamscarsonline.twic.pics/210dcc6e-b610-48f2-910a-a846c50c498d/cefc075c-2413-482f-a75f-930a0bcb47b0.jpg?twic=v1/resize=650&twic=v1/cover=250x188, https://bonhamscarsonline.twic.pics/210dcc6e-b610-48f2-910a-a846c50c498d/2412a845-3329-4c48-b142-193d108c4d25.jpg?twic=v1/resize=650&twic=v1/cover=250x188, https://bonhamscarsonline.twic.pics/210dcc6e-b610-48f2-910a-a846c50c498d/a602f273-d1e8-4f5b-9504-3b33081080ac.jpg?twic=v1/resize=650&twic=v1/cover=250x188, https://bonhamscarsonline.twic.pics/210dcc6e-b610-48f2-910a-a846c50c498d/d7183aa6-be83-4af8-bce0-761b1c95200b.jpg?twic=v1/resize=650&twic=v1/cover=250x188, https://bonhamscarsonline.twic.pics/210dcc6e-b610-48f2-910a-a846c50c498d/2c06a31c-be00-4459-977f-b594e5db9f21.jpg?twic=v1/resize=650&twic=v1/cover=250x188, https://bonhamscarsonline.twic.pics/210dcc6e-b610-48f2-910a-a846c50c498d/304bab7d-049e-4159-80be-c5d4adf406f1.jpg?twic=v1/resize=650&twic=v1/cover=250x188, https://bonhamscarsonline.twic.pics/210dcc6e-b610-48f2-910a-a846c50c498d/b78b7f7d-5970-43b8-8001-9c34f89eb356.jpg?twic=v1/resize=650&twic=v1/cover=250x188, https://bonhamscarsonline.twic.pics/210dcc6e-b610-48f2-910a-a846c50c498d/7d93210f-6e24-4bbc-abb5-f77fd3a3081a.jpg?twic=v1/resize=650&twic=v1/cover=250x188","Accompanying documentation and this car’s registered engine number (rather than the original one stamped into the engine bay data plate) reveals that this TA at some point acquired an engine from the later MG TB. This should be considered as a very good thing. The TA’s MPJG engine from the Wolseley Ten was considered a bit of a weak link and was always viewed as a developmental cul de sac by MG. The XPAG 1250cc unit fitted here, however, would go on to power a range of MG cars for the next 15 years or so. Proving a much more tuneable unit, the factory specification claimed a 54bhp output at 5,200 rpm.
We know from the thorough restoration records that some significant engine work was undertaken in 2004 and further supported by the photographic record. This included the fitment of new pistons, main bearings and big ends, a re-core and re-face of the block and regrind of the crank shaft. Unleaded valve seats were also fitted at this stage. This work is thought to have been undertaken just a few thousand miles ago.
The under-bonnet presentation of the TA is excellent, of course. Lifting the panels of the gull-winged bonnet reveals a deeply polished cam cover atop a red painted block. There are numerous areas of charming detail in here, too. These include the brass data plates, the spare spark plug receptacle, a pair of wooden lidded and fully stocked tool chests. The underside of the car looks pleasingly fresh and clean and in keeping with a full restoration just a few thousand miles ago.","https://bonhamscarsonline.twic.pics/210dcc6e-b610-48f2-910a-a846c50c498d/cc1fa835-5a48-4847-8696-15741341ed2a.jpg?twic=v1/resize=650&twic=v1/cover=250x188, https://bonhamscarsonline.twic.pics/210dcc6e-b610-48f2-910a-a846c50c498d/dde61e3f-9ccd-4e87-ba71-8c6990000ba9.jpg?twic=v1/resize=650&twic=v1/cover=250x188, https://bonhamscarsonline.twic.pics/210dcc6e-b610-48f2-910a-a846c50c498d/ad0da7c1-1d7e-4d6e-8685-792d01df1b8f.jpg?twic=v1/resize=650&twic=v1/cover=250x188, https://bonhamscarsonline.twic.pics/210dcc6e-b610-48f2-910a-a846c50c498d/58f48bbd-027e-49a0-9cb5-d9ac5b1ed70f.jpg?twic=v1/resize=650&twic=v1/cover=250x188, https://bonhamscarsonline.twic.pics/210dcc6e-b610-48f2-910a-a846c50c498d/030d0529-accc-490c-9d95-df021308872a.jpg?twic=v1/resize=650&twic=v1/cover=250x188, https://bonhamscarsonline.twic.pics/210dcc6e-b610-48f2-910a-a846c50c498d/a1a4847a-8f98-4581-999f-345d339f40be.jpg?twic=v1/resize=650&twic=v1/cover=250x188, https://bonhamscarsonline.twic.pics/210dcc6e-b610-48f2-910a-a846c50c498d/c1f91eb3-4cd7-4b69-8dff-84e51a924717.jpg?twic=v1/resize=650&twic=v1/cover=250x188, https://bonhamscarsonline.twic.pics/210dcc6e-b610-48f2-910a-a846c50c498d/abf5efe4-88d2-4d52-9e3e-3c5b40f72a1b.jpg?twic=v1/resize=650&twic=v1/cover=250x188, https://bonhamscarsonline.twic.pics/210dcc6e-b610-48f2-910a-a846c50c498d/44442cc3-79f7-44e1-bac9-5280539c93a0.jpg?twic=v1/resize=650&twic=v1/cover=250x188, https://bonhamscarsonline.twic.pics/210dcc6e-b610-48f2-910a-a846c50c498d/6deb8992-7ecb-4ff4-8579-5f966b7bf61c.jpg?twic=v1/resize=650&twic=v1/cover=250x188, https://bonhamscarsonline.twic.pics/210dcc6e-b610-48f2-910a-a846c50c498d/b37019f9-4db7-4cd7-8be6-ee1d661d028c.jpg?twic=v1/resize=650&twic=v1/cover=250x188, https://bonhamscarsonline.twic.pics/210dcc6e-b610-48f2-910a-a846c50c498d/fd5859c1-7be9-47f5-9286-eded33139523.jpg?twic=v1/resize=650&twic=v1/cover=250x188, https://bonhamscarsonline.twic.pics/210dcc6e-b610-48f2-910a-a846c50c498d/041858dd-08cd-41ef-8636-caca73cf4be7.jpg?twic=v1/resize=650&twic=v1/cover=250x188, https://bonhamscarsonline.twic.pics/210dcc6e-b610-48f2-910a-a846c50c498d/ab30b928-c676-41a5-85e4-fe5b9ea246e2.jpg?twic=v1/resize=650&twic=v1/cover=250x188, https://bonhamscarsonline.twic.pics/210dcc6e-b610-48f2-910a-a846c50c498d/1fddc4f2-e6ca-492f-9542-26a56c94a935.jpg?twic=v1/resize=650&twic=v1/cover=250x188, https://bonhamscarsonline.twic.pics/210dcc6e-b610-48f2-910a-a846c50c498d/4cf0614d-6724-487b-8d31-e518ba0bb00c.jpg?twic=v1/resize=650&twic=v1/cover=250x188, https://bonhamscarsonline.twic.pics/210dcc6e-b610-48f2-910a-a846c50c498d/d4b3f3f4-049d-4d74-95e9-41a01e4fc12c.jpg?twic=v1/resize=650&twic=v1/cover=250x188, https://bonhamscarsonline.twic.pics/210dcc6e-b610-48f2-910a-a846c50c498d/3632bf4e-d6da-4032-94f2-53446f98c894.jpg?twic=v1/resize=650&twic=v1/cover=250x188, https://bonhamscarsonline.twic.pics/210dcc6e-b610-48f2-910a-a846c50c498d/19103a5f-9f5b-451e-a2ac-56519f6cb306.jpg?twic=v1/resize=650&twic=v1/cover=250x188, https://bonhamscarsonline.twic.pics/210dcc6e-b610-48f2-910a-a846c50c498d/eedb6533-7a39-47cd-a01d-552b4c1743f3.jpg?twic=v1/resize=650&twic=v1/cover=250x188, https://bonhamscarsonline.twic.pics/210dcc6e-b610-48f2-910a-a846c50c498d/59edaa68-8a38-4db4-afe3-d13d6b7773a4.jpg?twic=v1/resize=650&twic=v1/cover=250x188, https://bonhamscarsonline.twic.pics/210dcc6e-b610-48f2-910a-a846c50c498d/389c1cf8-f8f0-4cec-af23-5884f11fa21d.jpg?twic=v1/resize=650&twic=v1/cover=250x188, https://bonhamscarsonline.twic.pics/210dcc6e-b610-48f2-910a-a846c50c498d/37ca46f4-d0e5-4849-b426-a5ccfe54ed74.jpg?twic=v1/resize=650&twic=v1/cover=250x188, https://bonhamscarsonline.twic.pics/210dcc6e-b610-48f2-910a-a846c50c498d/20577658-3a6d-4970-85ab-430ace87df7d.jpg?twic=v1/resize=650&twic=v1/cover=250x188, https://bonhamscarsonline.twic.pics/210dcc6e-b610-48f2-910a-a846c50c498d/addc432d-148c-445a-b177-d50cba9446a6.jpg?twic=v1/resize=650&twic=v1/cover=250x188, https://bonhamscarsonline.twic.pics/210dcc6e-b610-48f2-910a-a846c50c498d/f91c98de-8769-460c-9588-6d0e5e704af4.jpg?twic=v1/resize=650&twic=v1/cover=250x188, https://bonhamscarsonline.twic.pics/210dcc6e-b610-48f2-910a-a846c50c498d/3b111df4-44da-4342-8ee6-23f5b6fec740.jpg?twic=v1/resize=650&twic=v1/cover=250x188, https://bonhamscarsonline.twic.pics/210dcc6e-b610-48f2-910a-a846c50c498d/43201756-f972-48fe-acc1-eee3442d7aba.jpg?twic=v1/resize=650&twic=v1/cover=250x188, https://bonhamscarsonline.twic.pics/210dcc6e-b610-48f2-910a-a846c50c498d/be915d58-0ba8-4fd6-bfbc-af509423410b.jpg?twic=v1/resize=650&twic=v1/cover=250x188, https://bonhamscarsonline.twic.pics/210dcc6e-b610-48f2-910a-a846c50c498d/a8815cff-3dce-43c1-9691-f85ef4f87c99.jpg?twic=v1/resize=650&twic=v1/cover=250x188, https://bonhamscarsonline.twic.pics/210dcc6e-b610-48f2-910a-a846c50c498d/d1f90ca3-b45e-41c3-bb33-8515c560a417.jpg?twic=v1/resize=650&twic=v1/cover=250x188, https://bonhamscarsonline.twic.pics/210dcc6e-b610-48f2-910a-a846c50c498d/0e5ad43b-287d-4feb-b0b5-9402b1a0f4e1.jpg?twic=v1/resize=650&twic=v1/cover=250x188, https://bonhamscarsonline.twic.pics/210dcc6e-b610-48f2-910a-a846c50c498d/5535ac6a-3074-4dab-8498-c29dd0e4905b.jpg?twic=v1/resize=650&twic=v1/cover=250x188, https://bonhamscarsonline.twic.pics/210dcc6e-b610-48f2-910a-a846c50c498d/d1bc6c2d-0459-46ef-912c-a280c89c972c.jpg?twic=v1/resize=650&twic=v1/cover=250x188, https://bonhamscarsonline.twic.pics/210dcc6e-b610-48f2-910a-a846c50c498d/b5bd23dc-f90a-41ca-b16d-5e7a9b454404.jpg?twic=v1/resize=650&twic=v1/cover=250x188, https://bonhamscarsonline.twic.pics/210dcc6e-b610-48f2-910a-a846c50c498d/b30363cb-c7d8-4277-8439-da33aae3712f.jpg?twic=v1/resize=650&twic=v1/cover=250x188, https://bonhamscarsonline.twic.pics/210dcc6e-b610-48f2-910a-a846c50c498d/517ed62a-b988-4e87-8374-83a47384604c.jpg?twic=v1/resize=650&twic=v1/cover=250x188, https://bonhamscarsonline.twic.pics/210dcc6e-b610-48f2-910a-a846c50c498d/c5cb06fa-037f-414a-9b17-cd3533c2cf07.jpg?twic=v1/resize=650&twic=v1/cover=250x188, https://bonhamscarsonline.twic.pics/210dcc6e-b610-48f2-910a-a846c50c498d/e45844a7-9001-420b-93de-446835612535.jpg?twic=v1/resize=650&twic=v1/cover=250x188, https://bonhamscarsonline.twic.pics/210dcc6e-b610-48f2-910a-a846c50c498d/d62bd69b-7b4f-4ce0-b116-4e4f7009bd41.jpg?twic=v1/resize=650&twic=v1/cover=250x188, https://bonhamscarsonline.twic.pics/210dcc6e-b610-48f2-910a-a846c50c498d/2a52ba19-bc79-424a-88a6-38758a0d6897.jpg?twic=v1/resize=650&twic=v1/cover=250x188","There is plenty to get your teeth into here. The current V5 registration document is present. The MG’s Historic Vehicle status designates it as MoT exempt and zero rated for vehicle excise duty in the UK. A certified copy of the original “logbook” is also on hand. 
The remainder of the archive includes the highlights of the carefully and diligently logged restoration covering the period between 2004 and 2010. Not only is there a very comprehensive photographic record (also helpfully date stamped) but also supporting documentation accounting for parts acquired and work undertaken across 6 years. Other later invoices are also included and make for interesting reading.","https://bonhamscarsonline.twic.pics/210dcc6e-b610-48f2-910a-a846c50c498d/a0ae32e0-9df6-4c84-b085-0b3b2d1c1867.jpg?twic=v1/resize=650&twic=v1/cover=250x188, https://bonhamscarsonline.twic.pics/210dcc6e-b610-48f2-910a-a846c50c498d/44501e6f-b282-4c54-87ee-fcdee9459ad2.jpg?twic=v1/resize=650&twic=v1/cover=250x188, https://bonhamscarsonline.twic.pics/210dcc6e-b610-48f2-910a-a846c50c498d/17996aaf-9c92-4b09-859f-0743ece774cf.jpg?twic=v1/resize=650&twic=v1/cover=250x188, https://bonhamscarsonline.twic.pics/210dcc6e-b610-48f2-910a-a846c50c498d/effc93c7-1513-4b42-897e-a12358a3de6a.jpg?twic=v1/resize=650&twic=v1/cover=250x188, https://bonhamscarsonline.twic.pics/210dcc6e-b610-48f2-910a-a846c50c498d/f2bba6c9-3871-404c-9ad8-f5fc3749f075.jpg?twic=v1/resize=650&twic=v1/cover=250x188, https://bonhamscarsonline.twic.pics/210dcc6e-b610-48f2-910a-a846c50c498d/43f042a9-aa19-472b-bb64-4566463ecfc0.jpg?twic=v1/resize=650&twic=v1/cover=250x188, https://bonhamscarsonline.twic.pics/210dcc6e-b610-48f2-910a-a846c50c498d/f570b601-f4e6-4746-bde3-e7cb5a6a39ac.jpg?twic=v1/resize=650&twic=v1/cover=250x188, https://bonhamscarsonline.twic.pics/210dcc6e-b610-48f2-910a-a846c50c498d/7cb52c0c-932d-4fbf-9432-ca843da7e785.jpg?twic=v1/resize=650&twic=v1/cover=250x188, https://bonhamscarsonline.twic.pics/210dcc6e-b610-48f2-910a-a846c50c498d/f54d490a-30a2-444f-bc04-b2ad6238e0b7.jpg?twic=v1/resize=650&twic=v1/cover=250x188, https://bonhamscarsonline.twic.pics/210dcc6e-b610-48f2-910a-a846c50c498d/778ab8e2-1382-49d9-ad5c-3c66a120d61a.jpg?twic=v1/resize=650&twic=v1/cover=250x188, https://bonhamscarsonline.twic.pics/210dcc6e-b610-48f2-910a-a846c50c498d/7bb7a080-f1c4-413b-bf66-fd1131cf5a8c.jpg?twic=v1/resize=650&twic=v1/cover=250x188, https://bonhamscarsonline.twic.pics/210dcc6e-b610-48f2-910a-a846c50c498d/0fd4bd0b-3d3a-4a63-9a3b-1fbd0915b3b9.jpg?twic=v1/resize=650&twic=v1/cover=250x188, https://bonhamscarsonline.twic.pics/210dcc6e-b610-48f2-910a-a846c50c498d/e164c478-81e8-420f-803b-4958df83d94f.jpg?twic=v1/resize=650&twic=v1/cover=250x188, https://bonhamscarsonline.twic.pics/210dcc6e-b610-48f2-910a-a846c50c498d/610d2c10-b652-4eb2-ab86-b16898685e40.jpg?twic=v1/resize=650&twic=v1/cover=250x188, https://bonhamscarsonline.twic.pics/210dcc6e-b610-48f2-910a-a846c50c498d/31646272-718a-4f66-8b41-fc405d710318.jpg?twic=v1/resize=650&twic=v1/cover=250x188, https://bonhamscarsonline.twic.pics/210dcc6e-b610-48f2-910a-a846c50c498d/77ef2eb4-920b-454d-a90a-d152310f798f.jpg?twic=v1/resize=650&twic=v1/cover=250x188, https://bonhamscarsonline.twic.pics/210dcc6e-b610-48f2-910a-a846c50c498d/e38ef2ee-b353-495d-a406-859bc28e09f5.jpg?twic=v1/resize=650&twic=v1/cover=250x188, https://bonhamscarsonline.twic.pics/210dcc6e-b610-48f2-910a-a846c50c498d/d4010c2a-a756-4a44-9b2f-a6a771dfe47d.jpg?twic=v1/resize=650&twic=v1/cover=250x188, https://bonhamscarsonline.twic.pics/210dcc6e-b610-48f2-910a-a846c50c498d/35ee9bca-3c30-4072-b189-9f29662a2efa.jpg?twic=v1/resize=650&twic=v1/cover=250x188, https://bonhamscarsonline.twic.pics/210dcc6e-b610-48f2-910a-a846c50c498d/f10781b1-97b8-4226-bfd0-0ad8db9d48e9.jpg?twic=v1/resize=650&twic=v1/cover=250x188, https://bonhamscarsonline.twic.pics/210dcc6e-b610-48f2-910a-a846c50c498d/9f76ee5b-bda3-4685-81d2-9b844a99bd26.jpg?twic=v1/resize=650&twic=v1/cover=250x188, https://bonhamscarsonline.twic.pics/210dcc6e-b610-48f2-910a-a846c50c498d/697d8054-21ae-4b93-a71a-86265ff475c6.jpg?twic=v1/resize=650&twic=v1/cover=250x188, https://bonhamscarsonline.twic.pics/210dcc6e-b610-48f2-910a-a846c50c498d/ee99f4fc-9dad-4489-9b53-42b16497b16b.jpg?twic=v1/resize=650&twic=v1/cover=250x188, https://bonhamscarsonline.twic.pics/210dcc6e-b610-48f2-910a-a846c50c498d/b671a1a2-0180-4d81-a95b-63de34e58ad3.jpg?twic=v1/resize=650&twic=v1/cover=250x188, https://bonhamscarsonline.twic.pics/210dcc6e-b610-48f2-910a-a846c50c498d/5f88be12-8741-43e8-bae1-99eba65fdb82.jpg?twic=v1/resize=650&twic=v1/cover=250x188, https://bonhamscarsonline.twic.pics/210dcc6e-b610-48f2-910a-a846c50c498d/f09131dc-2291-41c8-b9d7-22b8fc944e33.jpg?twic=v1/resize=650&twic=v1/cover=250x188, https://bonhamscarsonline.twic.pics/210dcc6e-b610-48f2-910a-a846c50c498d/06050722-db9a-4643-b301-226ee1282dcf.jpg?twic=v1/resize=650&twic=v1/cover=250x188, https://bonhamscarsonline.twic.pics/210dcc6e-b610-48f2-910a-a846c50c498d/af0d0593-221d-4b1c-915c-b5b93f90c4dc.jpg?twic=v1/resize=650&twic=v1/cover=250x188, https://bonhamscarsonline.twic.pics/210dcc6e-b610-48f2-910a-a846c50c498d/95dcb531-bbff-4c2a-bf79-bcd08166595e.jpg?twic=v1/resize=650&twic=v1/cover=250x188, https://bonhamscarsonline.twic.pics/210dcc6e-b610-48f2-910a-a846c50c498d/8f98b705-257b-4872-89df-8655d73c2cba.jpg?twic=v1/resize=650&twic=v1/cover=250x188, https://bonhamscarsonline.twic.pics/210dcc6e-b610-48f2-910a-a846c50c498d/00ec8693-3bc9-4c1b-9194-beb70728db69.jpg?twic=v1/resize=650&twic=v1/cover=250x188, https://bonhamscarsonline.twic.pics/210dcc6e-b610-48f2-910a-a846c50c498d/05124fb1-8365-41ea-b649-5e5478d12168.jpg?twic=v1/resize=650&twic=v1/cover=250x188, https://bonhamscarsonline.twic.pics/210dcc6e-b610-48f2-910a-a846c50c498d/9b3ec5ab-7e26-42b8-855c-e89bea003388.jpg?twic=v1/resize=650&twic=v1/cover=250x188, https://bonhamscarsonline.twic.pics/210dcc6e-b610-48f2-910a-a846c50c498d/a3efeb20-4083-4a4c-9643-3c43ba2e8d1d.jpg?twic=v1/resize=650&twic=v1/cover=250x188, https://bonhamscarsonline.twic.pics/210dcc6e-b610-48f2-910a-a846c50c498d/26f1194f-ff34-499d-b7a9-505c7011644d.jpg?twic=v1/resize=650&twic=v1/cover=250x188, https://bonhamscarsonline.twic.pics/210dcc6e-b610-48f2-910a-a846c50c498d/afdfcbd3-7959-4c98-9a30-a47bb08e4cc7.jpg?twic=v1/resize=650&twic=v1/cover=250x188, https://bonhamscarsonline.twic.pics/210dcc6e-b610-48f2-910a-a846c50c498d/3997fad6-b021-4fd9-8a85-997e81822a76.jpg?twic=v1/resize=650&twic=v1/cover=250x188, https://bonhamscarsonline.twic.pics/210dcc6e-b610-48f2-910a-a846c50c498d/6b4d006f-2b10-467b-8c63-d8a3e7280fb2.jpg?twic=v1/resize=650&twic=v1/cover=250x188, https://bonhamscarsonline.twic.pics/210dcc6e-b610-48f2-910a-a846c50c498d/df561963-c3da-435b-8ae0-aa4946270c54.jpg?twic=v1/resize=650&twic=v1/cover=250x188, https://bonhamscarsonline.twic.pics/210dcc6e-b610-48f2-910a-a846c50c498d/faf9aa65-af79-4c8f-a42e-01fa48360f0c.jpg?twic=v1/resize=650&twic=v1/cover=250x188","The MG TA was a foretaste of what was to come with the T-type MG’s that would ultimately prevail well into the 1950’s. An origin of the species car that moved MG from a niche enthusiasts’ marque ultimately into one with a broader and worldwide appeal. Later iterations of the TA would go on to emphatically conquer the critical North American market and cement MG’s place as possibly the best known of sports car makers. And it all started here.
This example represents an exciting ownership prospect without doubt. It has clearly been beautifully and lovingly restored over six years and subsequently diligent kept and cared for. It is hard to find fault with it. The main weakness of the TA, it’s stop-gap engine, has been replaced with the much more admired XPAG unit from the TB. Surely this combination is a winning one and one that may prove hard to better.  
We are happy to offer this car for auction with an estimate in the range of £20,000 - £30,000.
Viewing is always encouraged, and this particular car is located with the vendor in Inverurie, Aberdeenshire. To arrange an appointment to view this vehicle please use the Contact Seller button at the top of the listing. Feel free to ask any questions or make observations in the comments section below, or try our ‘Frequently Asked Questions’."
