Title,Key Facts,chassis,mileage,engine,gearbox,color,interior,steering,fuel_type,Vehicle location,Background,Overview,Estimated value,Seller,exterior,Exterior_Images,interior_Images,mechanical,mechanical_Images,History,History_Images,Summary
1978 Datsun 260Z,"['Offered from long-term ownership', 'Offered with original books and manuals', 'Well preserved and increasingly desirable']",GRS30-016227,"57,461 Miles",2565cc,Manual,Yellow,"The interior continues the authenticity theme with the seats still being covered by the original fabric and vinyl.

Which would be a story all by itself even if they were frayed and full of holes; that they’re still plump and firm and free of any obvious damage, or even signs of wear, is remarkable.

The rear seats, individual and looking supremely snug and comfortable, are in an even better shape and we think it would be a safe bet that they haven’t seen much use over the years; just take a look at the sticker on the back of the passenger seat, for example.

The dashboard holds the factory fitted Hitachi radio, and the instruments and controls are still bright and legible, including the wonderfully labelled blue REAR DEFOGGER.

The black carpets are also still in great shape, and the door cards have survived the passage of almost half a century very well. Wonderfully, the electrically operated front windows are courtesy of ‘Servoglide’.

Which reminds us that the seller assures us that everything works as it should.

More luxury comes via some very of-the-period fake wood trim, and the huge Webasto-style sunroof and inner headlining are both in an excellent condition.

The steering wheel does show a little more wear but even that is more a case of some of the grain pattern having been rubbed off rather than anything more serious – and we really do mean “some of” because it, like everything else in the cockpit, is very good indeed.

As for the boot, the carpet in there is sun-faded and worn but it is still more than acceptable, especially if you value originality above all else.

Which means that problems are minor: the Perspex visor on the sunroof has a crack in it and a short section of the material covering the offside door card has come adrift on one edge.",Right-Hand Drive,Petrol,"Huntingdon, Cambridgeshire, United Kingdom","The replacement for the beloved 240Z, the 260Z was only in production between 1974 and 1978. With a bigger, 2,565cc engine courtesy of a longer stroke, the 260Z boasted 162bhp, which is usefully more than the outgoing car’s 151bhp. Torque was up too, and the Datsun could be had with a four-speed or five-speed manual gearbox, or a three-speed automatic.

The suspension was pretty much carried over from the 240Z, as were the brakes. The chassis was a bit stiffer but the changes were gentle evolution rather than anything bolder but that was understandable; the 240Z was widely lauded for its handling and why bother fixing it if it ain’t broke?

Performance is strong rather than vivid with the benchmark 60mph arriving after eight seconds dead on its way to a top speed of 127mph. Mind you, that’s better than two miles per minute, which is enough really, isn’t it?

It also feels faster than the car it replaced, with Motorsport writing at the time “the 260Z feels much more flexible and much quicker than the old 240” before summing it up: “This distinctive beast from the other side of the world is a true sports car in that it is fast, handles well, requires skill to drive it very quickly but is tremendous fun while doing so. On the other hand it is also a true GT car, for two, for it is capacious, comfortable, has a lazy, 120 m.p.h. cruising gait yet has a sensible fuel range. No wonder it sells so well.”

A 2+2, with a 300mm longer wheelbase, widened the Datsun’s appeal still further. A notched roofline to give a bit more rear headroom is the easiest way to spot one, and the transmission tunnel gained proper carpet rather than the quilted vinyl of the two-seater.

Time has been kind to the 240/260Z, and while rust is the biggest issue you’ll face the mechanicals are robust and strong, with 400,000 miles easily possible on the original engine if it’s maintained properly.","Still finished in its original yellow and boasting a black vinyl roof, ‘BTW 62T’ is a very of-the-seventies Datsun 260Z 2+2 that had just one owner between 1980 and the seller buying it in May 2024.

He used to work for Datsun back in the day, and seeing the authenticity of this UK-supplied, manual example left him with no option but to bid – and we can absolutely see the appeal, with bodywork even our hard-nosed assessor described as “great”.

It’s got plenty of original interior fixtures and fittings too, is utterly solid, and runs like a dream all of which means we expect this legendary sportscar to attract an awful lot of interest.","£18,000 - £24,000",Private: markg1962,"The yellow paintwork is wonderful, isn’t it? We suspect, in fact we’re sure, it’s had work over the years but the fact it still wears its factory hue as proudly as it does is a wonderful thing.

As is the black vinyl roof, another period feature we’re always pleased to see alongside period essentials like a boot spoiler, twin exhaust tailpipes, a deep front air dam, and some chunky four-spoke OE Nissan alloy wheels.

The latter are free of scrapes, scuffs, and other parking damage and are also fitted with a full set of 175/80R14 Hankook Kinergy Eco tyres.

We will never get tired of telling you that experience shows that matching high-quality tyres are an infallible sign of a caring and mechanically sympathetic owner who is prepared to spend the appropriate amount in maintaining their car properly.

As for the condition of the rest of the coachwork, the panels still fit very well. With good shutlines and no ripples along the flanks, there’s also a remarkable lack of the sort of dinks and dents you’d expect a car of this age to have collected along the way.

Being a car of the seventies there’s a smattering of chromework too of course, and this is in good shape and largely free of pitting and rust. It’s also great to see that the bumpers run nice and straight.

The glass is good too, and we can see the windows have been etched with the car’s registration number.

The badges are a little faded but carry an authentic patina, and the lamp lenses are bright and free of damage.

Which brings us onto the subject of issues you might like to get ahead of.

You’ll be pleased to hear there really aren’t many other than some bubbling around the boot aperture.","https://bonhamscarsonline.twic.pics/a5802e41-4f77-4e79-856d-640cd69aa379/246c5b3e-d177-4c1a-8bd0-4ed680adc583.jpg?twic=v1/resize=650&twic=v1/cover=250x188, https://bonhamscarsonline.twic.pics/a5802e41-4f77-4e79-856d-640cd69aa379/6eee4b6c-9ff4-4a65-a5e1-d2185b576b5b.jpg?twic=v1/resize=650&twic=v1/cover=250x188, https://bonhamscarsonline.twic.pics/a5802e41-4f77-4e79-856d-640cd69aa379/b7a8b5ff-03dc-4b9c-883f-c02774390f28.jpg?twic=v1/resize=650&twic=v1/cover=250x188, https://bonhamscarsonline.twic.pics/a5802e41-4f77-4e79-856d-640cd69aa379/76a6b8d7-c763-497f-b9a3-55161e6bb795.jpg?twic=v1/resize=650&twic=v1/cover=250x188, https://bonhamscarsonline.twic.pics/a5802e41-4f77-4e79-856d-640cd69aa379/61f9bc59-db0a-44c6-a4a1-6bea01c833c5.jpg?twic=v1/resize=650&twic=v1/cover=250x188, https://bonhamscarsonline.twic.pics/a5802e41-4f77-4e79-856d-640cd69aa379/0e47de75-ee88-42c5-9e2e-9199477c3ac1.jpg?twic=v1/resize=650&twic=v1/cover=250x188, https://bonhamscarsonline.twic.pics/a5802e41-4f77-4e79-856d-640cd69aa379/36dd95db-0041-46f8-a072-e6eca9ad502e.jpg?twic=v1/resize=650&twic=v1/cover=250x188, https://bonhamscarsonline.twic.pics/a5802e41-4f77-4e79-856d-640cd69aa379/aa1dd90b-15e4-4b52-9978-1a446ee1d1ef.jpg?twic=v1/resize=650&twic=v1/cover=250x188, https://bonhamscarsonline.twic.pics/a5802e41-4f77-4e79-856d-640cd69aa379/897e761b-d2c5-4975-b6ca-e6508694886a.jpg?twic=v1/resize=650&twic=v1/cover=250x188, https://bonhamscarsonline.twic.pics/a5802e41-4f77-4e79-856d-640cd69aa379/3b53afbf-553f-4e64-9835-af6c1e3516a0.jpg?twic=v1/resize=650&twic=v1/cover=250x188, https://bonhamscarsonline.twic.pics/a5802e41-4f77-4e79-856d-640cd69aa379/e0662cab-412a-41d8-9c6c-db62236e5f44.jpg?twic=v1/resize=650&twic=v1/cover=250x188, https://bonhamscarsonline.twic.pics/a5802e41-4f77-4e79-856d-640cd69aa379/f72cd88e-306e-418e-9d0a-749fb732079b.jpg?twic=v1/resize=650&twic=v1/cover=250x188, https://bonhamscarsonline.twic.pics/a5802e41-4f77-4e79-856d-640cd69aa379/007fa06b-b2df-44f8-9543-51a85bd9dd37.jpg?twic=v1/resize=650&twic=v1/cover=250x188, https://bonhamscarsonline.twic.pics/a5802e41-4f77-4e79-856d-640cd69aa379/c49f9cdc-aca4-43d5-a64a-aa9c40ed680d.jpg?twic=v1/resize=650&twic=v1/cover=250x188, https://bonhamscarsonline.twic.pics/a5802e41-4f77-4e79-856d-640cd69aa379/f476a329-6860-4a15-8c2e-107803832500.jpg?twic=v1/resize=650&twic=v1/cover=250x188, https://bonhamscarsonline.twic.pics/a5802e41-4f77-4e79-856d-640cd69aa379/866f7166-97bb-4e45-8132-3bf477209669.jpg?twic=v1/resize=650&twic=v1/cover=250x188, https://bonhamscarsonline.twic.pics/a5802e41-4f77-4e79-856d-640cd69aa379/87302489-201a-4fd7-963e-0e0580e359b9.jpg?twic=v1/resize=650&twic=v1/cover=250x188, https://bonhamscarsonline.twic.pics/a5802e41-4f77-4e79-856d-640cd69aa379/0a200fa4-3e04-4d45-b216-71a73f3b92d5.jpg?twic=v1/resize=650&twic=v1/cover=250x188, https://bonhamscarsonline.twic.pics/a5802e41-4f77-4e79-856d-640cd69aa379/6a97438c-3dd7-49ab-a0f6-cd0615938239.jpg?twic=v1/resize=650&twic=v1/cover=250x188, https://bonhamscarsonline.twic.pics/a5802e41-4f77-4e79-856d-640cd69aa379/5a758857-b22b-459f-9ca7-5bf6a0fce050.jpg?twic=v1/resize=650&twic=v1/cover=250x188, https://bonhamscarsonline.twic.pics/a5802e41-4f77-4e79-856d-640cd69aa379/44a63727-5da8-4659-98c2-4fe120f33753.jpg?twic=v1/resize=650&twic=v1/cover=250x188, https://bonhamscarsonline.twic.pics/a5802e41-4f77-4e79-856d-640cd69aa379/0f0f62f0-6b1c-41a2-afe9-03558ab152c0.jpg?twic=v1/resize=650&twic=v1/cover=250x188, https://bonhamscarsonline.twic.pics/a5802e41-4f77-4e79-856d-640cd69aa379/3f9cfea1-26f0-4b61-b511-60926382f1fe.jpg?twic=v1/resize=650&twic=v1/cover=250x188, https://bonhamscarsonline.twic.pics/a5802e41-4f77-4e79-856d-640cd69aa379/f3c6a25b-3c27-49e5-8c23-ec2410e073f6.jpg?twic=v1/resize=650&twic=v1/cover=250x188, https://bonhamscarsonline.twic.pics/a5802e41-4f77-4e79-856d-640cd69aa379/68c5ec98-33e2-493d-b3e2-c8c633920bbb.jpg?twic=v1/resize=650&twic=v1/cover=250x188, https://bonhamscarsonline.twic.pics/a5802e41-4f77-4e79-856d-640cd69aa379/c46dc2ed-e5ed-460e-ab5e-13d7ad8a6167.jpg?twic=v1/resize=650&twic=v1/cover=250x188, https://bonhamscarsonline.twic.pics/a5802e41-4f77-4e79-856d-640cd69aa379/8fc7b3a1-8bc4-4a2e-8bf1-d017d10de54a.jpg?twic=v1/resize=650&twic=v1/cover=250x188, https://bonhamscarsonline.twic.pics/a5802e41-4f77-4e79-856d-640cd69aa379/4b8cb31f-7b10-4a70-93b5-2741ca52ce0b.jpg?twic=v1/resize=650&twic=v1/cover=250x188, https://bonhamscarsonline.twic.pics/a5802e41-4f77-4e79-856d-640cd69aa379/f70ba487-c80e-48ff-86d2-efa9c268f116.jpg?twic=v1/resize=650&twic=v1/cover=250x188, https://bonhamscarsonline.twic.pics/a5802e41-4f77-4e79-856d-640cd69aa379/b72e68bf-1d17-48f0-a2ca-2e70464cd456.jpg?twic=v1/resize=650&twic=v1/cover=250x188, https://bonhamscarsonline.twic.pics/a5802e41-4f77-4e79-856d-640cd69aa379/d37dc5e2-f0f4-48b5-b4ae-7e2ee9c50120.jpg?twic=v1/resize=650&twic=v1/cover=250x188, https://bonhamscarsonline.twic.pics/a5802e41-4f77-4e79-856d-640cd69aa379/a9b3e232-4904-4446-aaaf-7f86a4245ad8.jpg?twic=v1/resize=650&twic=v1/cover=250x188, https://bonhamscarsonline.twic.pics/a5802e41-4f77-4e79-856d-640cd69aa379/01ffa5c8-7525-412f-8a67-d0cd5606be43.jpg?twic=v1/resize=650&twic=v1/cover=250x188, https://bonhamscarsonline.twic.pics/a5802e41-4f77-4e79-856d-640cd69aa379/3322eb67-1e33-4aba-84be-044989a7bbf3.jpg?twic=v1/resize=650&twic=v1/cover=250x188, https://bonhamscarsonline.twic.pics/a5802e41-4f77-4e79-856d-640cd69aa379/74feebfc-30f7-4ff8-8a50-1b009627bbd7.jpg?twic=v1/resize=650&twic=v1/cover=250x188, https://bonhamscarsonline.twic.pics/a5802e41-4f77-4e79-856d-640cd69aa379/79d2bcc4-46bc-4473-acc6-a7a3a64ea33a.jpg?twic=v1/resize=650&twic=v1/cover=250x188, https://bonhamscarsonline.twic.pics/a5802e41-4f77-4e79-856d-640cd69aa379/df5aa105-0a47-4684-a814-102b0bbff525.jpg?twic=v1/resize=650&twic=v1/cover=250x188, https://bonhamscarsonline.twic.pics/a5802e41-4f77-4e79-856d-640cd69aa379/392571a9-73d8-4922-97ba-c7c47d4dda1f.jpg?twic=v1/resize=650&twic=v1/cover=250x188, https://bonhamscarsonline.twic.pics/a5802e41-4f77-4e79-856d-640cd69aa379/20b6ace9-c575-4904-92bd-bb9588947310.jpg?twic=v1/resize=650&twic=v1/cover=250x188, https://bonhamscarsonline.twic.pics/a5802e41-4f77-4e79-856d-640cd69aa379/8ef96f9d-fc0e-462e-95ef-17d4e8347eeb.jpg?twic=v1/resize=650&twic=v1/cover=250x188, https://bonhamscarsonline.twic.pics/a5802e41-4f77-4e79-856d-640cd69aa379/023109c2-5084-48dd-8bd3-ce411cdf6d40.jpg?twic=v1/resize=650&twic=v1/cover=250x188, https://bonhamscarsonline.twic.pics/a5802e41-4f77-4e79-856d-640cd69aa379/30fd38cd-0598-439e-acd1-1a9ff4c7ce44.jpg?twic=v1/resize=650&twic=v1/cover=250x188","https://bonhamscarsonline.twic.pics/a5802e41-4f77-4e79-856d-640cd69aa379/e540b14a-2931-4229-a7f1-0075c0fce02b.jpg?twic=v1/resize=650&twic=v1/cover=250x188, https://bonhamscarsonline.twic.pics/a5802e41-4f77-4e79-856d-640cd69aa379/87244eb1-4d9b-4b33-969a-96ee21317fb2.jpg?twic=v1/resize=650&twic=v1/cover=250x188, https://bonhamscarsonline.twic.pics/a5802e41-4f77-4e79-856d-640cd69aa379/bdcb0a0d-70fc-4c0d-b7be-aeaf6a12923b.jpg?twic=v1/resize=650&twic=v1/cover=250x188, https://bonhamscarsonline.twic.pics/a5802e41-4f77-4e79-856d-640cd69aa379/eae01a24-ee89-4f6c-8d85-80cb7f6c24cc.jpg?twic=v1/resize=650&twic=v1/cover=250x188, https://bonhamscarsonline.twic.pics/a5802e41-4f77-4e79-856d-640cd69aa379/eea25459-2955-42ae-8a0a-b6fcdd737fe2.jpg?twic=v1/resize=650&twic=v1/cover=250x188, https://bonhamscarsonline.twic.pics/a5802e41-4f77-4e79-856d-640cd69aa379/cdc12daf-331f-48c5-a17b-a67ec0d2adfb.jpg?twic=v1/resize=650&twic=v1/cover=250x188, https://bonhamscarsonline.twic.pics/a5802e41-4f77-4e79-856d-640cd69aa379/1536119c-8820-4425-bce4-b926d163bbbe.jpg?twic=v1/resize=650&twic=v1/cover=250x188, https://bonhamscarsonline.twic.pics/a5802e41-4f77-4e79-856d-640cd69aa379/de873b3c-45cc-4dda-87e0-bded22af34bf.jpg?twic=v1/resize=650&twic=v1/cover=250x188, https://bonhamscarsonline.twic.pics/a5802e41-4f77-4e79-856d-640cd69aa379/d7056d9b-511b-42de-96fc-7b089b705f8b.jpg?twic=v1/resize=650&twic=v1/cover=250x188, https://bonhamscarsonline.twic.pics/a5802e41-4f77-4e79-856d-640cd69aa379/21f63dcf-d20c-417e-896f-7935155fa8f5.jpg?twic=v1/resize=650&twic=v1/cover=250x188, https://bonhamscarsonline.twic.pics/a5802e41-4f77-4e79-856d-640cd69aa379/d0490f7c-d671-43c4-acc2-f6776ef612e0.jpg?twic=v1/resize=650&twic=v1/cover=250x188, https://bonhamscarsonline.twic.pics/a5802e41-4f77-4e79-856d-640cd69aa379/52030327-41af-4ffd-b1e6-69f7e53a9c13.jpg?twic=v1/resize=650&twic=v1/cover=250x188, https://bonhamscarsonline.twic.pics/a5802e41-4f77-4e79-856d-640cd69aa379/2616aa99-12ed-4d27-9408-95f1094236cd.jpg?twic=v1/resize=650&twic=v1/cover=250x188, https://bonhamscarsonline.twic.pics/a5802e41-4f77-4e79-856d-640cd69aa379/32fab3e2-a2c3-498e-9bc1-deb8063d6fc4.jpg?twic=v1/resize=650&twic=v1/cover=250x188, https://bonhamscarsonline.twic.pics/a5802e41-4f77-4e79-856d-640cd69aa379/d0773c41-2daa-43b5-9ec6-71cbd7cc9e06.jpg?twic=v1/resize=650&twic=v1/cover=250x188, https://bonhamscarsonline.twic.pics/a5802e41-4f77-4e79-856d-640cd69aa379/0b1a3b82-4f05-4099-9f70-9595e7701a67.jpg?twic=v1/resize=650&twic=v1/cover=250x188, https://bonhamscarsonline.twic.pics/a5802e41-4f77-4e79-856d-640cd69aa379/f4ab6222-4a6f-401e-a54a-1e45440ed9e3.jpg?twic=v1/resize=650&twic=v1/cover=250x188, https://bonhamscarsonline.twic.pics/a5802e41-4f77-4e79-856d-640cd69aa379/08ff762a-6966-49e1-bfd4-275a0cede40b.jpg?twic=v1/resize=650&twic=v1/cover=250x188, https://bonhamscarsonline.twic.pics/a5802e41-4f77-4e79-856d-640cd69aa379/6b331cf2-abbe-419e-9d91-ad18e7fdea91.jpg?twic=v1/resize=650&twic=v1/cover=250x188, https://bonhamscarsonline.twic.pics/a5802e41-4f77-4e79-856d-640cd69aa379/49ed382a-7fe0-41fb-af70-29ac59162648.jpg?twic=v1/resize=650&twic=v1/cover=250x188, https://bonhamscarsonline.twic.pics/a5802e41-4f77-4e79-856d-640cd69aa379/dbb1e704-66ef-4769-b7cd-92e96a8cfe7d.jpg?twic=v1/resize=650&twic=v1/cover=250x188, https://bonhamscarsonline.twic.pics/a5802e41-4f77-4e79-856d-640cd69aa379/48a3ea19-c6c2-4525-875f-d26156fc45f6.jpg?twic=v1/resize=650&twic=v1/cover=250x188, https://bonhamscarsonline.twic.pics/a5802e41-4f77-4e79-856d-640cd69aa379/b10aeb51-2ab1-4c5e-9aee-d12c86339611.jpg?twic=v1/resize=650&twic=v1/cover=250x188, https://bonhamscarsonline.twic.pics/a5802e41-4f77-4e79-856d-640cd69aa379/c7e4c123-6cf9-4cbe-b5e1-fe7de2598f76.jpg?twic=v1/resize=650&twic=v1/cover=250x188, https://bonhamscarsonline.twic.pics/a5802e41-4f77-4e79-856d-640cd69aa379/62e671c8-a255-471c-a678-da5a46cb7524.jpg?twic=v1/resize=650&twic=v1/cover=250x188, https://bonhamscarsonline.twic.pics/a5802e41-4f77-4e79-856d-640cd69aa379/728144f9-2757-4e00-ab2a-b53fccd84ce1.jpg?twic=v1/resize=650&twic=v1/cover=250x188, https://bonhamscarsonline.twic.pics/a5802e41-4f77-4e79-856d-640cd69aa379/1b8e69a9-321f-4dc4-b4c4-503bff461d74.jpg?twic=v1/resize=650&twic=v1/cover=250x188, https://bonhamscarsonline.twic.pics/a5802e41-4f77-4e79-856d-640cd69aa379/a7cb898c-43cb-403d-97ed-5585905d5df5.jpg?twic=v1/resize=650&twic=v1/cover=250x188, https://bonhamscarsonline.twic.pics/a5802e41-4f77-4e79-856d-640cd69aa379/cf9eb14c-f00f-48f4-898c-b2f74f5122da.jpg?twic=v1/resize=650&twic=v1/cover=250x188, https://bonhamscarsonline.twic.pics/a5802e41-4f77-4e79-856d-640cd69aa379/e130d9ec-fd86-4881-8e3b-d78659d7fde8.jpg?twic=v1/resize=650&twic=v1/cover=250x188, https://bonhamscarsonline.twic.pics/a5802e41-4f77-4e79-856d-640cd69aa379/a033bca5-94fa-4869-88ab-a68abd807914.jpg?twic=v1/resize=650&twic=v1/cover=250x188, https://bonhamscarsonline.twic.pics/a5802e41-4f77-4e79-856d-640cd69aa379/70972771-2834-412e-b41d-85c516aac781.jpg?twic=v1/resize=650&twic=v1/cover=250x188, https://bonhamscarsonline.twic.pics/a5802e41-4f77-4e79-856d-640cd69aa379/73e9c7d3-66c9-4a86-b628-2250a3e59abe.jpg?twic=v1/resize=650&twic=v1/cover=250x188, https://bonhamscarsonline.twic.pics/a5802e41-4f77-4e79-856d-640cd69aa379/961ffb34-510e-4c08-9748-319643d6ff7b.jpg?twic=v1/resize=650&twic=v1/cover=250x188","The seller took the 260Z out of winter hibernation a couple of weeks ago and treated it to fresh fuel plus a new fuel filter and pump. As you can see, the 2.6-litre engine starts and runs very well: as the seller says, that legendary Japanese engineering still shines through, even now.

The engine bay is as original as everything else; true, there is scope for improvement if detailing is your thing or you plan to show it, but we imagine most folk would be more than happy to leave it as it is, especially given nobody has tried to prettify it over the years with inappropriate ‘upgrades’ like silicone hoses and anodized fittings.

As for the underside, we don’t think describing it as exceptional is too strong because it looks to be very well preserved thanks to a winning combination of diligent curation and factory underseal.

And it’s not just us that thinks this: while the MoT record might be patchy, there’s never been any mention of underbody corrosion or structural rot, which would seem to confirm our impressions.

It will almost certainly need some work before it will pass an MoT, as it failed in April 2022 on the following:

• Headlamp not working on dipped beam (4.1.1 (a) (ii))
• Nearside Front Position lamp not working (4.2.1 (a) (ii))
• Offside Front Position lamp not working (4.2.1 (a) (ii))
• Exhaust emissions carbon monoxide content excessive (8.2.1.2 (b))
• Service brake efficiency below requirements (1.2.2 (a) (i))

It was also given an advisory for: Exhaust emits black smoke during acceleration (8.2.1.2 (g))","https://bonhamscarsonline.twic.pics/a5802e41-4f77-4e79-856d-640cd69aa379/718df9e1-ab42-4631-b415-bbe71532b318.jpg?twic=v1/resize=650&twic=v1/cover=250x188, https://bonhamscarsonline.twic.pics/a5802e41-4f77-4e79-856d-640cd69aa379/3a509233-90f6-4ffc-8f20-9df897de2f4f.jpg?twic=v1/resize=650&twic=v1/cover=250x188, https://bonhamscarsonline.twic.pics/a5802e41-4f77-4e79-856d-640cd69aa379/a7e8c09a-fc44-4695-aa9b-8018f8ae0b17.jpg?twic=v1/resize=650&twic=v1/cover=250x188, https://bonhamscarsonline.twic.pics/a5802e41-4f77-4e79-856d-640cd69aa379/81647e67-3c98-43e5-93b9-ea444773e190.jpg?twic=v1/resize=650&twic=v1/cover=250x188, https://bonhamscarsonline.twic.pics/a5802e41-4f77-4e79-856d-640cd69aa379/69fbafdf-d385-4e01-8e91-1e193253034a.jpg?twic=v1/resize=650&twic=v1/cover=250x188, https://bonhamscarsonline.twic.pics/a5802e41-4f77-4e79-856d-640cd69aa379/70d795b5-499a-4f20-bd1d-a1b244ef7c9f.jpg?twic=v1/resize=650&twic=v1/cover=250x188, https://bonhamscarsonline.twic.pics/a5802e41-4f77-4e79-856d-640cd69aa379/29cb21b2-1e72-4706-a726-ce6c49c54aed.jpg?twic=v1/resize=650&twic=v1/cover=250x188, https://bonhamscarsonline.twic.pics/a5802e41-4f77-4e79-856d-640cd69aa379/385538e4-fae0-4a04-a670-942f7177f0fb.jpg?twic=v1/resize=650&twic=v1/cover=250x188, https://bonhamscarsonline.twic.pics/a5802e41-4f77-4e79-856d-640cd69aa379/a2316b3d-215f-4090-bc9d-0a832d6879b7.jpg?twic=v1/resize=650&twic=v1/cover=250x188, https://bonhamscarsonline.twic.pics/a5802e41-4f77-4e79-856d-640cd69aa379/972e50a8-ff22-4782-9e84-39ae23e9c0af.jpg?twic=v1/resize=650&twic=v1/cover=250x188, https://bonhamscarsonline.twic.pics/a5802e41-4f77-4e79-856d-640cd69aa379/161ef218-1d71-4a58-92f5-4ac371f1d3e1.jpg?twic=v1/resize=650&twic=v1/cover=250x188, https://bonhamscarsonline.twic.pics/a5802e41-4f77-4e79-856d-640cd69aa379/37af9e7f-ea83-4e90-acd9-59f16c8f8c3c.jpg?twic=v1/resize=650&twic=v1/cover=250x188, https://bonhamscarsonline.twic.pics/a5802e41-4f77-4e79-856d-640cd69aa379/e4be9125-d056-408c-8eb5-1c40f93a1e03.jpg?twic=v1/resize=650&twic=v1/cover=250x188, https://bonhamscarsonline.twic.pics/a5802e41-4f77-4e79-856d-640cd69aa379/54fa1848-27bf-4930-a796-dbb829e44a6b.jpg?twic=v1/resize=650&twic=v1/cover=250x188, https://bonhamscarsonline.twic.pics/a5802e41-4f77-4e79-856d-640cd69aa379/7e3f4388-486b-45be-bdbb-15c5986a1962.jpg?twic=v1/resize=650&twic=v1/cover=250x188, https://bonhamscarsonline.twic.pics/a5802e41-4f77-4e79-856d-640cd69aa379/44a67506-df2f-4b01-9789-557d2129addb.jpg?twic=v1/resize=650&twic=v1/cover=250x188, https://bonhamscarsonline.twic.pics/a5802e41-4f77-4e79-856d-640cd69aa379/d5acbc07-c756-4fb0-9542-789a3e6496d8.jpg?twic=v1/resize=650&twic=v1/cover=250x188, https://bonhamscarsonline.twic.pics/a5802e41-4f77-4e79-856d-640cd69aa379/8e3c79bf-124c-480e-9d0d-0be2c78520ac.jpg?twic=v1/resize=650&twic=v1/cover=250x188, https://bonhamscarsonline.twic.pics/a5802e41-4f77-4e79-856d-640cd69aa379/587248aa-038f-446a-8bac-00cacb83a8f0.jpg?twic=v1/resize=650&twic=v1/cover=250x188, https://bonhamscarsonline.twic.pics/a5802e41-4f77-4e79-856d-640cd69aa379/fbe0ea5a-1058-4286-b66f-1f0481644106.jpg?twic=v1/resize=650&twic=v1/cover=250x188","The Datsun doesn’t have a current MoT certificate, and while it is exempt by virtue of its age, we would strongly encourage the new owner to have it MoT’d at the earliest opportunity. The cost of an MoT is a small investment when offset against the purchase and upkeep of any classic vehicle, and it gives an independent, third-party assessment of the car’s condition, which not only provides reassurance to the owner (and any subsequent purchasers) but might also be invaluable in the event of a bump when negotiating with the police and any interested insurance companies…

It's been a while since it’s had a ticket but the 57,461 miles that’s currently showing on its odometer ties in with the 57,240 miles recorded by the Man from the Ministry when it last passed in 2007.

The recent Vehicle History Check is clear, and the history file includes the original stamped service history booklet, the owner’s handbook, and the rest of the bumf in the wallet most people would have thrown out, which means that even the paperwork has charm.","https://bonhamscarsonline.twic.pics/a5802e41-4f77-4e79-856d-640cd69aa379/e96fc742-027d-4963-a984-1fca424f0b00.jpg?twic=v1/resize=650&twic=v1/cover=250x188, https://bonhamscarsonline.twic.pics/a5802e41-4f77-4e79-856d-640cd69aa379/344453e8-a777-4a55-b9ce-169ba4758167.jpg?twic=v1/resize=650&twic=v1/cover=250x188, https://bonhamscarsonline.twic.pics/a5802e41-4f77-4e79-856d-640cd69aa379/d5819eb0-1b02-414c-9084-961bf72fe81c.jpg?twic=v1/resize=650&twic=v1/cover=250x188, https://bonhamscarsonline.twic.pics/a5802e41-4f77-4e79-856d-640cd69aa379/504b6a58-1274-4b94-b5d6-cdcbde803c2c.jpg?twic=v1/resize=650&twic=v1/cover=250x188, https://bonhamscarsonline.twic.pics/a5802e41-4f77-4e79-856d-640cd69aa379/65ff57d5-911b-4fbf-a24b-ae01b3c5c664.jpg?twic=v1/resize=650&twic=v1/cover=250x188, https://bonhamscarsonline.twic.pics/a5802e41-4f77-4e79-856d-640cd69aa379/ffda055a-ba1a-410f-b125-f15c430a1a9a.jpg?twic=v1/resize=650&twic=v1/cover=250x188, https://bonhamscarsonline.twic.pics/a5802e41-4f77-4e79-856d-640cd69aa379/6c8a639c-2939-40e5-ab4f-9d6b1946e48d.jpg?twic=v1/resize=650&twic=v1/cover=250x188, https://bonhamscarsonline.twic.pics/a5802e41-4f77-4e79-856d-640cd69aa379/9b1aadbb-05f0-4804-ae58-8c5516900c15.jpg?twic=v1/resize=650&twic=v1/cover=250x188, https://bonhamscarsonline.twic.pics/a5802e41-4f77-4e79-856d-640cd69aa379/f475b159-a151-4756-800a-40b39e4e4eef.jpg?twic=v1/resize=650&twic=v1/cover=250x188, https://bonhamscarsonline.twic.pics/a5802e41-4f77-4e79-856d-640cd69aa379/53ee081e-2136-4391-a148-88dfe09f1aff.jpg?twic=v1/resize=650&twic=v1/cover=250x188, https://bonhamscarsonline.twic.pics/a5802e41-4f77-4e79-856d-640cd69aa379/494d02a6-0784-4808-ac44-5b741246f58f.jpg?twic=v1/resize=650&twic=v1/cover=250x188, https://bonhamscarsonline.twic.pics/a5802e41-4f77-4e79-856d-640cd69aa379/c15928af-3854-423c-9e1d-f23dc3d2edfb.jpg?twic=v1/resize=650&twic=v1/cover=250x188, https://bonhamscarsonline.twic.pics/a5802e41-4f77-4e79-856d-640cd69aa379/bf50f214-c065-4757-973d-8704a1e138ba.jpg?twic=v1/resize=650&twic=v1/cover=250x188","Cars like this, that haven’t been messed around with and are largely original, are rarer than you imagine – and Japanese cars from the seventies that have survived as well as this are even rarer.
And this is no ordinary Japanese car; it’s an icon, a sporting legend, and while the profile of the 2+2 coupé might lack a little of the purity of the two-seater original, that is reflected in the price.
Which we expect to settle between £18,000 and £24,000, which feels like remarkable value for such an original and solid example that could continue to fulfill the role of thrilling sportscar.
And if you wanted to further improve it and show it as an example of what European car manufacturers feared all those years ago, even that would be within easy reach of the average DIYer.
Viewing is strongly encouraged, and this particular car is located with the vendor in Huntingdon, Cambridgeshire. To arrange an appointment to inspect this vehicle, please use the ‘Enquire About This Vehicle’ button on the listing. Feel free to ask any questions, or try our ‘Frequently Asked Questions’."
