Title,Key Facts,chassis,mileage,engine,gearbox,color,interior,steering,fuel_type,Vehicle location,Background,Overview,Estimated value,Seller,exterior,Exterior_Images,interior_Images,mechanical,mechanical_Images,History,History_Images,Summary
1972 Volkswagen T2 Campervan,"['High Quality Restoration by Morecambe & Wize Ltd', 'Ready For Summer', 'Californian Import']",2322151936,"18,119 Miles",1600cc,Manual,Sunflower Yellow,"The cabin was completely rebuilt in 2017 too, and the new furniture includes a full-width rock ‘n’ roll bed with space for another two to sleep under the pop-up roof above. 

The rock ‘n’ roll bed provides seating for three and there’s an additional buddy seat opposite with storage space underneath. This means you can sit around the stowaway table that cleverly tucks away in the rear roof space when it’s not being used.

All the seating was repaired as necessary in 2017 before being recovered in Champagne vinyl material. This included the cushions for the bed and the front seats. Interestingly, the front and buddy seats are embossed with the ‘MW’ logo, which is a lovely touch and one that gives us even more confidence in the quality of the rest of the work.

The front seats have seatbelts fitted, and the spares that come with the ‘van include another two that could be fitted in the rear.

Curtains are fitted throughout, and there is enough spare new material to make another set. Linen and blankets are also included.

The flooring is in an excellent condition with only a few minor marks.

New cabinets were also fitted by M&W, along with a new fridge/freezer, sink, and two-ring gas hob.

Electrickery includes a face-off Sony headunit and speakers, USB charging points, and a leisure battery with a hook-up point for connecting to the mains. EHU cables are included.

There’s a remote-controlled immobiliser too, and the instructions for using this are in the history file.

The seller is full of praise for the cleverness of the campervan’s interior; she says they never felt cramped, and when they pitched up at a campsite her job was to raise the roof while her husband plugged them in to shore power “and within five minutes we were drinking tea!” she laughed.

Mind you, by the time M&W built this one they had got eight years of experience under their belt, so the fact they’d got the design and build quality nailed isn’t a surprise.

The dashboard is the original and as for cosmetic flaws, there are a couple of marks to the door cards, the steering wheel is a little more patinated than everything else, and there is overspray on the pedals.

So, again, trivial stuff.",Left-Hand Drive,Petrol,"Bonhams|Cars Online HQ, United Kingdom","The Volkswagen Type 2 Transporter van’s forward control layout endowed it with huge versatility, and it was configured in a bewildering number of variants, from a hard-core panel van that lacked both rear seats and side windows through to the (reasonably) luxurious Samba Deluxe with its two-tone paint finish, full-length headlining and eight passenger seats.

What they all have in common is the Beetle’s - and later the Porsche 914’s - iconic flat-four, rear-mounted air-cooled engine and while the Type 2 might have started life modestly it gained both capacity and power over the years, ending its life in Germany with a 1600cc, 47bhp engine and in America with a two-litre, 65bhp unit.

It is perhaps best known for the ubiquitous campervan, which started life as a home brewed concoction used for travel to places as exotic as Iran and Afghanistan.

Now thoroughly modernised, like this example, they tend to be fitted with a double bed, a sink and a cooker unit plus, perhaps, a rising roof for more headroom and additional sleeping space.

A whole new generation are discovering the delights of a life that includes a T2 camper in it; whether being used as a day van that provides hot drinks and a shelter for hard-core surfers or a long-term home for overlanding and exploration, few things in life are as faithful and reliable as a Type 2 Transporter.

By the time production ended almost 1.5 million Transporters of various hues and roles had rolled off European production lines - and it’s fair to say that a significant percentage of them are still trundling along thanks to a fanatical following and an almost unparalleled spares and support network.

Famously robust, reliable, and hugely popular, the Type 2 remained in production in Brazil until increasingly stringent regulations finally killed it off in 2013.","Finished in Sunflower Yellow and Champagne – has any colour combination ever better summed up vanlife – this 1972 Volkswagen Type 2 Transporter campervan came to these shores from the sunny climes of California in 2017.

‘HHR 760K’, who is known within her family as Sophia, was built and completely restored in the same year by VW campervan specialists Morecambe and Wize. The work was comprehensive, comprising a bare metal respray before being refitted with many new and reconditioned components, including the rebuilt original 1600cc air-cooled engine.

The seller and her husband chose to commission Sophia from this particular company after hiring a camper van called Ernie, that had been restored by M&W, as a surprise weekend away – and they went from just one trip to buying Sophia within a month, which speaks volumes as to the quality of their work.

They found dealing with Morecambe and Wize a delight too, and the past years with her in their lives have been wonderful: “She was our pride and joy. Everywhere we went people loved her. She's been totally reliable; she's never broken down”.

Freshly serviced and fitted with a new battery at the very end of 2024, only a change in circumstances is forcing the sale of this beloved campervan.","£22,000 - £27,000",Private: ejm,"The Transporter was stripped down to a bare shell in 2017 as the first stage in its restoration. The bodyshell was then soda-blasted before being etch primed and then painted in Sunflower Yellow, a wonderful shade that is straight out of the VW catalogue.

All of the metalwork was covered, so the engine bay and interior are finished to the same high standard as the exterior.

The wheels and bumpers were then colour-coded in Lotus White to complement the coachwork, as was the pop-up roof. The latter also received new fabric sides and new seals when it was reinstalled, with the doors and windows also being refitted with new rubber seals.

The front of the ‘van was refreshed in December 2024, and the overall condition is very good indeed with excellent shutlines and an attractive gloss to the paintwork.

But then it should look good given how well she’s been looked after. How well? We hear you ask. Well, let’s put it this way; her husband went to the trouble and expense of raising their garage roof to provide Sophia with somewhere dry to live: “She’s very much a part of the family.”

The steel wheels are finished with a set of chromed hubcaps, and the T2 sits on 185R14 tyres, with one being an Event Road 2005, and the other three being Kormoran Vanpro. The spare tyre, which lives on the nearside rear inside the cabin, is a brand new Event that still has the label on it.

The pop-up roof rises and falls as it should, and the fabric sides look very smart. The fabric is also fitted with mesh inserts to provide a draft of air while still keeping the bugs out.

There’s a recess up top too, plus lash-down points, so it could be used to carry light luggage.

The lamp lenses, window glazing, and badges are all good, the numberplates are a pair of smart pressed aluminium plates, and a natty aerial sits on the offside front.

As for flaws, there is a dink on the offside of the rear bumper, minor surface corrosion and pitting to front headlight covers and the wiper arms, an area of bubbling beneath the offside rear door, and a small chip to the offside rear panel just below the window.

There is excess adhesive on rubber trim on the doorsteps, sticker residue on the rear panels, evidence of overspray on some door rubbers, and very light staining to the paint near the fuel cap.

Nothing much to worry about then, and you could sort most of that with a weekends work and minimal investment other than elbow grease.","https://bonhamscarsonline.twic.pics/77fcc99b-a050-454e-9d31-6a8d61ab04a1/d6bd8f77-fe78-45bb-9984-82a1b43a581f.jpg?twic=v1/resize=650&twic=v1/cover=250x188, https://bonhamscarsonline.twic.pics/77fcc99b-a050-454e-9d31-6a8d61ab04a1/b7228670-f45f-46ad-8460-3130f53bd5bf.jpg?twic=v1/resize=650&twic=v1/cover=250x188, https://bonhamscarsonline.twic.pics/77fcc99b-a050-454e-9d31-6a8d61ab04a1/7918179b-72e8-4dc1-8e30-96a994c483fd.jpg?twic=v1/resize=650&twic=v1/cover=250x188, https://bonhamscarsonline.twic.pics/77fcc99b-a050-454e-9d31-6a8d61ab04a1/786702b3-a1d6-4a96-87fe-24a80c36b25a.jpg?twic=v1/resize=650&twic=v1/cover=250x188, https://bonhamscarsonline.twic.pics/77fcc99b-a050-454e-9d31-6a8d61ab04a1/62f92b25-5804-4792-a184-990556d84195.jpg?twic=v1/resize=650&twic=v1/cover=250x188, https://bonhamscarsonline.twic.pics/77fcc99b-a050-454e-9d31-6a8d61ab04a1/91a2e38d-565c-4df2-812a-f538b0a519ce.jpg?twic=v1/resize=650&twic=v1/cover=250x188, https://bonhamscarsonline.twic.pics/77fcc99b-a050-454e-9d31-6a8d61ab04a1/9685c4ce-73e4-4749-9973-c03c0e4673a2.jpg?twic=v1/resize=650&twic=v1/cover=250x188, https://bonhamscarsonline.twic.pics/77fcc99b-a050-454e-9d31-6a8d61ab04a1/f866ca9f-2c5a-4113-ad6b-9eab9db7a76b.jpg?twic=v1/resize=650&twic=v1/cover=250x188, https://bonhamscarsonline.twic.pics/77fcc99b-a050-454e-9d31-6a8d61ab04a1/09c69b8b-7217-4209-b9c1-a97fa3fd2785.jpg?twic=v1/resize=650&twic=v1/cover=250x188, https://bonhamscarsonline.twic.pics/77fcc99b-a050-454e-9d31-6a8d61ab04a1/1c27c472-86f6-4384-891f-bfe116fcac42.jpg?twic=v1/resize=650&twic=v1/cover=250x188, https://bonhamscarsonline.twic.pics/77fcc99b-a050-454e-9d31-6a8d61ab04a1/a2e396b8-d281-4af2-8cbf-4a0df3f2dd9f.jpg?twic=v1/resize=650&twic=v1/cover=250x188, https://bonhamscarsonline.twic.pics/77fcc99b-a050-454e-9d31-6a8d61ab04a1/1ad58aec-7cb7-4397-bdb0-73bfb85dd7ed.jpg?twic=v1/resize=650&twic=v1/cover=250x188, https://bonhamscarsonline.twic.pics/77fcc99b-a050-454e-9d31-6a8d61ab04a1/b0bc4c82-f30c-4d7b-9ee4-f14c8950de68.jpg?twic=v1/resize=650&twic=v1/cover=250x188, https://bonhamscarsonline.twic.pics/77fcc99b-a050-454e-9d31-6a8d61ab04a1/f0651388-af22-4582-9671-39d3e70d0d62.jpg?twic=v1/resize=650&twic=v1/cover=250x188, https://bonhamscarsonline.twic.pics/77fcc99b-a050-454e-9d31-6a8d61ab04a1/3a769d16-cf30-4ee0-9e17-307aaa9f59fe.jpg?twic=v1/resize=650&twic=v1/cover=250x188, https://bonhamscarsonline.twic.pics/77fcc99b-a050-454e-9d31-6a8d61ab04a1/819673f1-c24b-4ffa-b558-37a1acb7bd0b.jpg?twic=v1/resize=650&twic=v1/cover=250x188, https://bonhamscarsonline.twic.pics/77fcc99b-a050-454e-9d31-6a8d61ab04a1/5df6e187-9cc6-4107-8602-a5b3c7ddb8dc.jpg?twic=v1/resize=650&twic=v1/cover=250x188, https://bonhamscarsonline.twic.pics/77fcc99b-a050-454e-9d31-6a8d61ab04a1/b1b663f0-b4c3-46e5-b9c6-5d82e5f1a38e.jpg?twic=v1/resize=650&twic=v1/cover=250x188, https://bonhamscarsonline.twic.pics/77fcc99b-a050-454e-9d31-6a8d61ab04a1/024158a1-c99f-45d2-b3ef-5d9831c3d7e5.jpg?twic=v1/resize=650&twic=v1/cover=250x188, https://bonhamscarsonline.twic.pics/77fcc99b-a050-454e-9d31-6a8d61ab04a1/a0778414-ec5d-4325-948b-90e5295dea30.jpg?twic=v1/resize=650&twic=v1/cover=250x188, https://bonhamscarsonline.twic.pics/77fcc99b-a050-454e-9d31-6a8d61ab04a1/44ff1eba-4657-4e99-aed5-c38274974282.jpg?twic=v1/resize=650&twic=v1/cover=250x188, https://bonhamscarsonline.twic.pics/77fcc99b-a050-454e-9d31-6a8d61ab04a1/48c6c5eb-85e9-4d1c-a714-a96952c33dea.jpg?twic=v1/resize=650&twic=v1/cover=250x188, https://bonhamscarsonline.twic.pics/77fcc99b-a050-454e-9d31-6a8d61ab04a1/c437cb02-a988-44c5-83dc-ded105e6a944.jpg?twic=v1/resize=650&twic=v1/cover=250x188, https://bonhamscarsonline.twic.pics/77fcc99b-a050-454e-9d31-6a8d61ab04a1/20058a25-97d9-43ae-9a21-817893ee4109.jpg?twic=v1/resize=650&twic=v1/cover=250x188, https://bonhamscarsonline.twic.pics/77fcc99b-a050-454e-9d31-6a8d61ab04a1/68f213bb-a20b-4eee-a3f7-886162a6d005.jpg?twic=v1/resize=650&twic=v1/cover=250x188, https://bonhamscarsonline.twic.pics/77fcc99b-a050-454e-9d31-6a8d61ab04a1/a62c93d9-6cf7-4eec-ad7f-ec5659ce3767.jpg?twic=v1/resize=650&twic=v1/cover=250x188, https://bonhamscarsonline.twic.pics/77fcc99b-a050-454e-9d31-6a8d61ab04a1/a4fbc3b4-4939-4319-b638-eb0a527ce6d6.jpg?twic=v1/resize=650&twic=v1/cover=250x188, https://bonhamscarsonline.twic.pics/77fcc99b-a050-454e-9d31-6a8d61ab04a1/9c208750-00dc-44ce-b505-82e5a8008e33.jpg?twic=v1/resize=650&twic=v1/cover=250x188, https://bonhamscarsonline.twic.pics/77fcc99b-a050-454e-9d31-6a8d61ab04a1/12f0abc2-7fad-4d04-bf72-d4586ab97ee0.jpg?twic=v1/resize=650&twic=v1/cover=250x188, https://bonhamscarsonline.twic.pics/77fcc99b-a050-454e-9d31-6a8d61ab04a1/86267c82-d870-420e-9f11-b380dda54508.jpg?twic=v1/resize=650&twic=v1/cover=250x188, https://bonhamscarsonline.twic.pics/77fcc99b-a050-454e-9d31-6a8d61ab04a1/c2c8a746-45b3-414f-a856-5086dfe5ec89.jpg?twic=v1/resize=650&twic=v1/cover=250x188, https://bonhamscarsonline.twic.pics/77fcc99b-a050-454e-9d31-6a8d61ab04a1/280644a2-9901-44f2-83d8-1187badf2516.jpg?twic=v1/resize=650&twic=v1/cover=250x188, https://bonhamscarsonline.twic.pics/77fcc99b-a050-454e-9d31-6a8d61ab04a1/493218b7-19b8-4395-b99f-f8edbfe42e51.jpg?twic=v1/resize=650&twic=v1/cover=250x188, https://bonhamscarsonline.twic.pics/77fcc99b-a050-454e-9d31-6a8d61ab04a1/89f07f78-8966-4016-bf6a-3fc915164ae4.jpg?twic=v1/resize=650&twic=v1/cover=250x188, https://bonhamscarsonline.twic.pics/77fcc99b-a050-454e-9d31-6a8d61ab04a1/2df217bf-4cf7-4db4-8ec6-28dbbb25bc49.jpg?twic=v1/resize=650&twic=v1/cover=250x188, https://bonhamscarsonline.twic.pics/77fcc99b-a050-454e-9d31-6a8d61ab04a1/13492374-b6a0-4071-a559-6c70ad094b4a.jpg?twic=v1/resize=650&twic=v1/cover=250x188, https://bonhamscarsonline.twic.pics/77fcc99b-a050-454e-9d31-6a8d61ab04a1/0fbb7b7f-c955-4e2f-bb66-e05297856731.jpg?twic=v1/resize=650&twic=v1/cover=250x188, https://bonhamscarsonline.twic.pics/77fcc99b-a050-454e-9d31-6a8d61ab04a1/bf806e04-9b77-4a4b-8044-a778fb9906e0.jpg?twic=v1/resize=650&twic=v1/cover=250x188, https://bonhamscarsonline.twic.pics/77fcc99b-a050-454e-9d31-6a8d61ab04a1/10eb9397-42d8-4a14-b802-8a4312c1b563.jpg?twic=v1/resize=650&twic=v1/cover=250x188, https://bonhamscarsonline.twic.pics/77fcc99b-a050-454e-9d31-6a8d61ab04a1/c0a795b2-039f-49a8-8c00-27ddeca6aee8.jpg?twic=v1/resize=650&twic=v1/cover=250x188, https://bonhamscarsonline.twic.pics/77fcc99b-a050-454e-9d31-6a8d61ab04a1/845a289c-1ee2-4f5a-9a1f-89c923984fe2.jpg?twic=v1/resize=650&twic=v1/cover=250x188, https://bonhamscarsonline.twic.pics/77fcc99b-a050-454e-9d31-6a8d61ab04a1/75170c40-f077-4f54-848c-262fd1dd1cca.jpg?twic=v1/resize=650&twic=v1/cover=250x188, https://bonhamscarsonline.twic.pics/77fcc99b-a050-454e-9d31-6a8d61ab04a1/6cae0f07-443e-455d-a479-b52df0f9b2e0.jpg?twic=v1/resize=650&twic=v1/cover=250x188, https://bonhamscarsonline.twic.pics/77fcc99b-a050-454e-9d31-6a8d61ab04a1/ac8a09f8-9359-494d-9861-6a98489a6f94.jpg?twic=v1/resize=650&twic=v1/cover=250x188, https://bonhamscarsonline.twic.pics/77fcc99b-a050-454e-9d31-6a8d61ab04a1/491b23a2-3bd8-412a-a27f-8da55a6657fb.jpg?twic=v1/resize=650&twic=v1/cover=250x188, https://bonhamscarsonline.twic.pics/77fcc99b-a050-454e-9d31-6a8d61ab04a1/3c8dbf9f-bef3-4197-8eb7-53626057c33e.jpg?twic=v1/resize=650&twic=v1/cover=250x188, https://bonhamscarsonline.twic.pics/77fcc99b-a050-454e-9d31-6a8d61ab04a1/81172123-0619-483d-928e-2653692181db.jpg?twic=v1/resize=650&twic=v1/cover=250x188, https://bonhamscarsonline.twic.pics/77fcc99b-a050-454e-9d31-6a8d61ab04a1/7fe89e30-2d14-4f6e-8378-d95f5606b247.jpg?twic=v1/resize=650&twic=v1/cover=250x188, https://bonhamscarsonline.twic.pics/77fcc99b-a050-454e-9d31-6a8d61ab04a1/cc0c47fa-4d0b-4428-93f1-b244e9ea945d.jpg?twic=v1/resize=650&twic=v1/cover=250x188, https://bonhamscarsonline.twic.pics/77fcc99b-a050-454e-9d31-6a8d61ab04a1/7552268b-9f47-426c-94ce-f63d33f73585.jpg?twic=v1/resize=650&twic=v1/cover=250x188, https://bonhamscarsonline.twic.pics/77fcc99b-a050-454e-9d31-6a8d61ab04a1/d2afeee6-ace5-44a9-a39c-2f0a12b67f8a.jpg?twic=v1/resize=650&twic=v1/cover=250x188, https://bonhamscarsonline.twic.pics/77fcc99b-a050-454e-9d31-6a8d61ab04a1/31c5a938-977f-4564-b87c-7e7026c4ffef.jpg?twic=v1/resize=650&twic=v1/cover=250x188, https://bonhamscarsonline.twic.pics/77fcc99b-a050-454e-9d31-6a8d61ab04a1/676978c2-9cdb-474c-9f74-f33277040777.jpg?twic=v1/resize=650&twic=v1/cover=250x188, https://bonhamscarsonline.twic.pics/77fcc99b-a050-454e-9d31-6a8d61ab04a1/cc457032-d4ae-40f9-ae04-d7e607dabc73.jpg?twic=v1/resize=650&twic=v1/cover=250x188, https://bonhamscarsonline.twic.pics/77fcc99b-a050-454e-9d31-6a8d61ab04a1/559d4298-a277-45ca-ad11-e37d1458cbcc.jpg?twic=v1/resize=650&twic=v1/cover=250x188, https://bonhamscarsonline.twic.pics/77fcc99b-a050-454e-9d31-6a8d61ab04a1/ac6b567a-f87e-4856-8781-5cd9f0eb310f.jpg?twic=v1/resize=650&twic=v1/cover=250x188, https://bonhamscarsonline.twic.pics/77fcc99b-a050-454e-9d31-6a8d61ab04a1/45ad7348-9c21-4344-8da3-43683a05edbf.jpg?twic=v1/resize=650&twic=v1/cover=250x188, https://bonhamscarsonline.twic.pics/77fcc99b-a050-454e-9d31-6a8d61ab04a1/21e84f87-444c-4283-b66f-2acea7a6b2f2.jpg?twic=v1/resize=650&twic=v1/cover=250x188, https://bonhamscarsonline.twic.pics/77fcc99b-a050-454e-9d31-6a8d61ab04a1/c6452bc6-61e4-4771-ba13-488f8da8f570.jpg?twic=v1/resize=650&twic=v1/cover=250x188, https://bonhamscarsonline.twic.pics/77fcc99b-a050-454e-9d31-6a8d61ab04a1/ac5f4d80-a835-44c9-a930-d7792553378e.jpg?twic=v1/resize=650&twic=v1/cover=250x188, https://bonhamscarsonline.twic.pics/77fcc99b-a050-454e-9d31-6a8d61ab04a1/aa7ecddb-3642-4a02-a13a-9b24950b1e5e.jpg?twic=v1/resize=650&twic=v1/cover=250x188, https://bonhamscarsonline.twic.pics/77fcc99b-a050-454e-9d31-6a8d61ab04a1/f71e9a8d-1517-4105-93ac-b03bd06e541e.jpg?twic=v1/resize=650&twic=v1/cover=250x188, https://bonhamscarsonline.twic.pics/77fcc99b-a050-454e-9d31-6a8d61ab04a1/1114fba2-0370-4d7f-86c8-9273398efafb.jpg?twic=v1/resize=650&twic=v1/cover=250x188, https://bonhamscarsonline.twic.pics/77fcc99b-a050-454e-9d31-6a8d61ab04a1/85b680fb-156b-49e4-9325-7a9b8a85d249.jpg?twic=v1/resize=650&twic=v1/cover=250x188, https://bonhamscarsonline.twic.pics/77fcc99b-a050-454e-9d31-6a8d61ab04a1/b3abe488-d93c-4521-b731-10f83b409093.jpg?twic=v1/resize=650&twic=v1/cover=250x188, https://bonhamscarsonline.twic.pics/77fcc99b-a050-454e-9d31-6a8d61ab04a1/10b79395-5515-432e-85a4-23fff0bef9fd.jpg?twic=v1/resize=650&twic=v1/cover=250x188, https://bonhamscarsonline.twic.pics/77fcc99b-a050-454e-9d31-6a8d61ab04a1/a726562b-0152-42a7-8ef3-96f59c380625.jpg?twic=v1/resize=650&twic=v1/cover=250x188, https://bonhamscarsonline.twic.pics/77fcc99b-a050-454e-9d31-6a8d61ab04a1/e451a370-c081-485e-b32e-43b8fb287add.jpg?twic=v1/resize=650&twic=v1/cover=250x188, https://bonhamscarsonline.twic.pics/77fcc99b-a050-454e-9d31-6a8d61ab04a1/bae8168b-9e72-4f38-9c29-e2c1a1f48ad7.jpg?twic=v1/resize=650&twic=v1/cover=250x188, https://bonhamscarsonline.twic.pics/77fcc99b-a050-454e-9d31-6a8d61ab04a1/01a09ca4-859e-4c94-8b86-b7a1d128b216.jpg?twic=v1/resize=650&twic=v1/cover=250x188, https://bonhamscarsonline.twic.pics/77fcc99b-a050-454e-9d31-6a8d61ab04a1/a25cfc4b-5c7c-4a09-82fa-ecf3412dcea3.jpg?twic=v1/resize=650&twic=v1/cover=250x188, https://bonhamscarsonline.twic.pics/77fcc99b-a050-454e-9d31-6a8d61ab04a1/59262c69-5659-457c-a878-9e1e29cca1c9.jpg?twic=v1/resize=650&twic=v1/cover=250x188, https://bonhamscarsonline.twic.pics/77fcc99b-a050-454e-9d31-6a8d61ab04a1/0220637f-8ba4-4ea8-8e60-a4e6cd2f158c.jpg?twic=v1/resize=650&twic=v1/cover=250x188, https://bonhamscarsonline.twic.pics/77fcc99b-a050-454e-9d31-6a8d61ab04a1/3ea7861d-0958-42a6-9e0f-167159358ca7.jpg?twic=v1/resize=650&twic=v1/cover=250x188, https://bonhamscarsonline.twic.pics/77fcc99b-a050-454e-9d31-6a8d61ab04a1/e394b702-7296-4cf9-b80c-4b0a7b6bb1c7.jpg?twic=v1/resize=650&twic=v1/cover=250x188, https://bonhamscarsonline.twic.pics/77fcc99b-a050-454e-9d31-6a8d61ab04a1/830aec43-4030-45c2-9e7b-d23debcd083a.jpg?twic=v1/resize=650&twic=v1/cover=250x188, https://bonhamscarsonline.twic.pics/77fcc99b-a050-454e-9d31-6a8d61ab04a1/5bf09e21-b3c4-4f06-8d14-ff7d9780d8aa.jpg?twic=v1/resize=650&twic=v1/cover=250x188, https://bonhamscarsonline.twic.pics/77fcc99b-a050-454e-9d31-6a8d61ab04a1/de4e0a88-d34f-4257-94a1-13ffce179fd9.jpg?twic=v1/resize=650&twic=v1/cover=250x188, https://bonhamscarsonline.twic.pics/77fcc99b-a050-454e-9d31-6a8d61ab04a1/44169223-4948-416e-8f15-f98b8e4851e8.jpg?twic=v1/resize=650&twic=v1/cover=250x188, https://bonhamscarsonline.twic.pics/77fcc99b-a050-454e-9d31-6a8d61ab04a1/543d14d1-0a7b-4251-b1e1-9bc704c8c6b9.jpg?twic=v1/resize=650&twic=v1/cover=250x188, https://bonhamscarsonline.twic.pics/77fcc99b-a050-454e-9d31-6a8d61ab04a1/4e6fef55-0a0d-44eb-bf35-0c1f46728ce3.jpg?twic=v1/resize=650&twic=v1/cover=250x188, https://bonhamscarsonline.twic.pics/77fcc99b-a050-454e-9d31-6a8d61ab04a1/2497e8ce-5d8d-4aa3-9171-756ebff0849d.jpg?twic=v1/resize=650&twic=v1/cover=250x188, https://bonhamscarsonline.twic.pics/77fcc99b-a050-454e-9d31-6a8d61ab04a1/5206c38a-6316-4e2b-a963-5d30aa4aff0d.jpg?twic=v1/resize=650&twic=v1/cover=250x188, https://bonhamscarsonline.twic.pics/77fcc99b-a050-454e-9d31-6a8d61ab04a1/6e294080-d9dd-4b9d-b7b5-cb7c53a4aafd.jpg?twic=v1/resize=650&twic=v1/cover=250x188, https://bonhamscarsonline.twic.pics/77fcc99b-a050-454e-9d31-6a8d61ab04a1/0dc043b8-8366-4ee8-b789-af25c89bbbe9.jpg?twic=v1/resize=650&twic=v1/cover=250x188, https://bonhamscarsonline.twic.pics/77fcc99b-a050-454e-9d31-6a8d61ab04a1/7d7ae67c-23b8-45b8-ac4b-2624ed90da8d.jpg?twic=v1/resize=650&twic=v1/cover=250x188, https://bonhamscarsonline.twic.pics/77fcc99b-a050-454e-9d31-6a8d61ab04a1/294fa3d5-58be-4f25-b19b-9822fff03489.jpg?twic=v1/resize=650&twic=v1/cover=250x188, https://bonhamscarsonline.twic.pics/77fcc99b-a050-454e-9d31-6a8d61ab04a1/eb80bc91-1790-401e-9c3e-6fd81c61e3a0.jpg?twic=v1/resize=650&twic=v1/cover=250x188","https://bonhamscarsonline.twic.pics/77fcc99b-a050-454e-9d31-6a8d61ab04a1/f5f5d761-8cce-4a53-b13a-4417343a6eb4.jpg?twic=v1/resize=650&twic=v1/cover=250x188, https://bonhamscarsonline.twic.pics/77fcc99b-a050-454e-9d31-6a8d61ab04a1/f93f88a7-0062-47cb-823d-4be031c73ba4.jpg?twic=v1/resize=650&twic=v1/cover=250x188, https://bonhamscarsonline.twic.pics/77fcc99b-a050-454e-9d31-6a8d61ab04a1/abaa9575-c312-4393-96fe-24ddf68e0444.jpg?twic=v1/resize=650&twic=v1/cover=250x188, https://bonhamscarsonline.twic.pics/77fcc99b-a050-454e-9d31-6a8d61ab04a1/ee997107-0084-46d0-a074-f5be90c30d1f.jpg?twic=v1/resize=650&twic=v1/cover=250x188, https://bonhamscarsonline.twic.pics/77fcc99b-a050-454e-9d31-6a8d61ab04a1/b94930f9-1a55-4edc-b491-c2ea7aae6a4c.jpg?twic=v1/resize=650&twic=v1/cover=250x188, https://bonhamscarsonline.twic.pics/77fcc99b-a050-454e-9d31-6a8d61ab04a1/300d8875-21fe-4cb4-9f37-99f33c9cacc6.jpg?twic=v1/resize=650&twic=v1/cover=250x188, https://bonhamscarsonline.twic.pics/77fcc99b-a050-454e-9d31-6a8d61ab04a1/757758d5-693b-4319-a3e4-5710cb959468.jpg?twic=v1/resize=650&twic=v1/cover=250x188, https://bonhamscarsonline.twic.pics/77fcc99b-a050-454e-9d31-6a8d61ab04a1/446e755e-6625-4013-b7cb-362b5c7f6a69.jpg?twic=v1/resize=650&twic=v1/cover=250x188, https://bonhamscarsonline.twic.pics/77fcc99b-a050-454e-9d31-6a8d61ab04a1/abbb3126-726c-4a13-b041-40911673b584.jpg?twic=v1/resize=650&twic=v1/cover=250x188, https://bonhamscarsonline.twic.pics/77fcc99b-a050-454e-9d31-6a8d61ab04a1/2809dd62-4847-4738-b9d9-61d3c96d89bd.jpg?twic=v1/resize=650&twic=v1/cover=250x188, https://bonhamscarsonline.twic.pics/77fcc99b-a050-454e-9d31-6a8d61ab04a1/4e35ff86-d7ec-480b-bf8b-3e0c0acfe769.jpg?twic=v1/resize=650&twic=v1/cover=250x188, https://bonhamscarsonline.twic.pics/77fcc99b-a050-454e-9d31-6a8d61ab04a1/1423a4ae-53ba-47e0-9549-2d5b7947ba4b.jpg?twic=v1/resize=650&twic=v1/cover=250x188, https://bonhamscarsonline.twic.pics/77fcc99b-a050-454e-9d31-6a8d61ab04a1/b9887215-379d-40de-a121-2f6a261fb693.jpg?twic=v1/resize=650&twic=v1/cover=250x188, https://bonhamscarsonline.twic.pics/77fcc99b-a050-454e-9d31-6a8d61ab04a1/1d5f21a7-66c7-4307-bea9-a2e319864031.jpg?twic=v1/resize=650&twic=v1/cover=250x188","As you can see, the original engine, which was rebuilt in 2017 as part of the restoration, starts and runs very well indeed.

The only mechanical problem we are aware of is the engine cover, which is stiff and would benefit from adjustment, lubrication and/or a new catch.

It should also be kept on a battery trickle charger to prevent discharge.

The engine bay is nicely presented, and bears witness to that recent expenditure.

As for the underside, it’s as clean and strong as you’d expect to see on a recently restored vehicle that’s spent much of its life in the sunny Californian climate – and been so thoroughly pampered here in the UK.","https://bonhamscarsonline.twic.pics/77fcc99b-a050-454e-9d31-6a8d61ab04a1/a6f18112-a2c4-4aae-92ea-0cc41ec34f17.jpg?twic=v1/resize=650&twic=v1/cover=250x188, https://bonhamscarsonline.twic.pics/77fcc99b-a050-454e-9d31-6a8d61ab04a1/9a945f3c-3d0a-434f-93cf-c02179b3189e.jpg?twic=v1/resize=650&twic=v1/cover=250x188, https://bonhamscarsonline.twic.pics/77fcc99b-a050-454e-9d31-6a8d61ab04a1/2903c700-103d-482e-8450-0247c59ba0b0.jpg?twic=v1/resize=650&twic=v1/cover=250x188, https://bonhamscarsonline.twic.pics/77fcc99b-a050-454e-9d31-6a8d61ab04a1/ddfc6c4e-70b4-427a-b0f4-c64c5946a432.jpg?twic=v1/resize=650&twic=v1/cover=250x188, https://bonhamscarsonline.twic.pics/77fcc99b-a050-454e-9d31-6a8d61ab04a1/206c02d6-56b1-4b00-9eac-15d7e445c4ff.jpg?twic=v1/resize=650&twic=v1/cover=250x188, https://bonhamscarsonline.twic.pics/77fcc99b-a050-454e-9d31-6a8d61ab04a1/76266cfc-3670-4945-b270-f89fea8de8f8.jpg?twic=v1/resize=650&twic=v1/cover=250x188, https://bonhamscarsonline.twic.pics/77fcc99b-a050-454e-9d31-6a8d61ab04a1/70062f07-4556-471b-83de-0ade3a6865d4.jpg?twic=v1/resize=650&twic=v1/cover=250x188, https://bonhamscarsonline.twic.pics/77fcc99b-a050-454e-9d31-6a8d61ab04a1/a61e87d4-c2fd-43e1-a2d0-197f7cfba485.jpg?twic=v1/resize=650&twic=v1/cover=250x188, https://bonhamscarsonline.twic.pics/77fcc99b-a050-454e-9d31-6a8d61ab04a1/3d80f8a5-c7f5-4e8f-8b5e-32115f03d38a.jpg?twic=v1/resize=650&twic=v1/cover=250x188, https://bonhamscarsonline.twic.pics/77fcc99b-a050-454e-9d31-6a8d61ab04a1/f13e64df-4929-408a-8fcf-931f952ebf09.jpg?twic=v1/resize=650&twic=v1/cover=250x188","The VW’s MoT certificate expired in October 2024, which means it doesn’t have a current MoT certificate. Yes, it is exempt by virtue of its age, but we would nonetheless encourage the new owner to have it MoT’d at the earliest opportunity.

The recent Vehicle History Check is clear bar the marker for being an imported vehicle, and the VW comes with two sets of keys and two remote
controls for the immobiliser.

The invoices for the work in 2017 by Morecambe and Wize are on file, as is the invoice for the comprehensive service and new battery it received in December 2024.","https://bonhamscarsonline.twic.pics/77fcc99b-a050-454e-9d31-6a8d61ab04a1/5ca92f89-d891-49d1-81d4-19bb4ef5295a.jpg?twic=v1/resize=650&twic=v1/cover=250x188, https://bonhamscarsonline.twic.pics/77fcc99b-a050-454e-9d31-6a8d61ab04a1/172829ed-80ee-482b-afc1-7622bc9cb9d8.jpg?twic=v1/resize=650&twic=v1/cover=250x188, https://bonhamscarsonline.twic.pics/77fcc99b-a050-454e-9d31-6a8d61ab04a1/805c37f6-49e4-4c95-99aa-e4c55d7c57a9.jpg?twic=v1/resize=650&twic=v1/cover=250x188, https://bonhamscarsonline.twic.pics/77fcc99b-a050-454e-9d31-6a8d61ab04a1/d6dc4c87-4f43-48c3-8069-9f85a615e384.jpg?twic=v1/resize=650&twic=v1/cover=250x188, https://bonhamscarsonline.twic.pics/77fcc99b-a050-454e-9d31-6a8d61ab04a1/f85f6953-af05-47c6-801d-834414011a01.jpg?twic=v1/resize=650&twic=v1/cover=250x188, https://bonhamscarsonline.twic.pics/77fcc99b-a050-454e-9d31-6a8d61ab04a1/c3c886aa-4890-49f1-9988-8171eaf19cac.jpg?twic=v1/resize=650&twic=v1/cover=250x188, https://bonhamscarsonline.twic.pics/77fcc99b-a050-454e-9d31-6a8d61ab04a1/4a4ab19f-ce3b-426c-b887-3e4a05bded91.jpg?twic=v1/resize=650&twic=v1/cover=250x188, https://bonhamscarsonline.twic.pics/77fcc99b-a050-454e-9d31-6a8d61ab04a1/a1037886-e736-4cfb-8a45-81d73f876f36.jpg?twic=v1/resize=650&twic=v1/cover=250x188, https://bonhamscarsonline.twic.pics/77fcc99b-a050-454e-9d31-6a8d61ab04a1/03fd72f5-ceb2-432f-b0fe-031efce02204.jpg?twic=v1/resize=650&twic=v1/cover=250x188, https://bonhamscarsonline.twic.pics/77fcc99b-a050-454e-9d31-6a8d61ab04a1/5804df52-8f5e-42c3-8030-e8542d42d565.jpg?twic=v1/resize=650&twic=v1/cover=250x188, https://bonhamscarsonline.twic.pics/77fcc99b-a050-454e-9d31-6a8d61ab04a1/53013ac3-e1e6-4fe0-a9a3-d681f7d76117.jpg?twic=v1/resize=650&twic=v1/cover=250x188, https://bonhamscarsonline.twic.pics/77fcc99b-a050-454e-9d31-6a8d61ab04a1/deb2c223-237d-4acc-a364-dbab0e838cd7.jpg?twic=v1/resize=650&twic=v1/cover=250x188, https://bonhamscarsonline.twic.pics/77fcc99b-a050-454e-9d31-6a8d61ab04a1/c8d60851-1ab5-4576-95b8-74e6e649209c.jpg?twic=v1/resize=650&twic=v1/cover=250x188, https://bonhamscarsonline.twic.pics/77fcc99b-a050-454e-9d31-6a8d61ab04a1/d80dd770-213d-4e53-9282-6db9bf6e2c05.jpg?twic=v1/resize=650&twic=v1/cover=250x188, https://bonhamscarsonline.twic.pics/77fcc99b-a050-454e-9d31-6a8d61ab04a1/c728f7ca-440d-4ff4-b842-4d7df182f643.jpg?twic=v1/resize=650&twic=v1/cover=250x188","With a guide price of between £22,000 and £27,000, this Volkswagen Type 2 campervan offers the enthusiast an awful lot of possibilities: it could be used for weekends and holidays away, both here and abroad; it could be used to encompass the whole #vanlife lifestyle, giving you a place to live and work from; or it could be used as a haven to support your hobbies.

Heck, it could even be used as a promotional/hospitality vehicle for your business, with all the tax breaks that could involve.

Regardless of what you use it for, this is a delightfully presented, strong, and reliable way to ease yourself into the VW campervan scene – and given it wove its magic on the seller back in 2017, we’re confident it’ll do the same for you and your family in 2025!
Viewing is strongly encouraged, and this lot is located at Bonhams|Cars Online HQ. Viewings are STRICTLY BY APPOINTMENT and we are open weekdays between 10am - 12pm or 2pm - 4pm. To make a booking, please use the ‘Enquire About This Vehicle’ button on the listing. Feel free to ask any questions, or try our ‘Frequently Asked Questions’."
